"id","pregunta","a","b","c","d","correcta"
"1","La ciudad sede de la Generalitat:","Será determinada por ley estatal","Será determinada por ley autonómica","Está determinada por el propio Estatuto de Autonomía","Será determinada por ley orgánica de la Comunitat Valenciana","C"
"2","La constitución de la Comunitat Valenciana lo es en expresión de su:","Independencia","Identidad diferenciada","Autoadministración","Soberanía","B"
"3","Qué artículo del Estatuto de Autonomía es el que determina el territorio de la Comunitat Valenciana:","El 5","El 3","El 12","El 2","D"
"4","Para que un descendiente de un español residente en el extranjero tenga los derechos políticos que determina el Estatuto de Autonomía será preciso:","Que así lo solicite","Que le haya sido otorgada carta de nacionalidad","Que disfrute de doble nacionalidad","Que la nacionalidad española le haya sido concedida mediante carta de naturaleza","A"
"5","La Comunitat Valenciana es la expresión de:","La voluntad democrática del pueblo valenciano","La libertad del pueblo valenciano","La concordancia del pueblo valenciano con la Constitución","La racionalidad autonómica del pueblo valenciano","A"
"6","La clase de vecindad que los ciudadanos deben tener para ostentar la condición política de valencianos es:","La administrativa","La Civil","La política","La afín","A"
"7","La simbología heráldica propia de la Comunitat Valenciana:","No podrá ser incorporada a la Senyera","El Estatuto de Autonomía no determina que sea incorporada a la Senyera","Deberá ser incorporada a la Senyera","Podrá dar lugar a una Senyera distinta a la tradicional","B"
"8","¿Cuántas barras rojas tiene la Senyera?","Cinco","No está determinado en el Estatuto de Autonomía","Tres","Cuatro","D"
"9","La sede de la Generalitat está en","El Palacio de la Generalitat","Cualquier municipio de la Comunitat Valenciana","El Palacio de las Corts","El Palacio del Pueblo Valenciano","A"
"10","Es objeto de la Comunitat Valenciana:","Defender la Constitución","Participar en las decisiones políticas del Estado Español","Reforzar la democracia","Participar en la configuración constitucional del Estado de los Autonomías","C"
"11","Los territorios en los que predomine la lengua castellana serán delimitados:","Por ley","Por el propio Estatuto de Autonomía","Por Decreto de la Presidencia de la Generalitat","Por Decreto de la Conselleria correspondiente","A"
"12","¿Cuál de los siguientes colores no forma parte de la Senyera?","El rojo","El verde","El azul","El amarillo","B"
"13","¿Quién se constituye en Comunidad Autónoma, según el ¿Estatuto de Autonomía?","La región valenciana","La Generalitat","Las provincias de la Comunitat","El pueblo valenciano","D"
"14","Las normas de la Generalitat:","No tendrán eficacia territorial","Tendrán eficacia territorial sin excepción alguna","Tendrán efectos retroactivos en cuanto a su eficacia temporal","Tendrán su eficacia territorial limitada por excepciones","D"
"15","En el Estatuto de Autonomía, Alicante, Castellón y Valencia al señalar el territorio que integra la Comunitat Valenciana, son denominadas:","Ciudades","Mancomunidades o ciudades","Entidades Históricas","Municipios","E"
"16","La vecindad para obtener la condición política de los valencianos debe ser obtenida:","En las ciudades de la Comunitat Valenciana","En cualquier municipio de la Comunitat Valenciana","En cualquier mancomunidad de la Comunitat Valenciana","En cualquier capital de la Comunitat Valenciana","B"
"17","La simbología heráldica propia de la Comunitat Valenciana será determinada:","Por una ley estatal","Por norma jurídica de la Comunitat Valenciana","Por una ley orgánica estatal","Por ley de Les Corts","D"
"18","Literalmente, según el Estatuto de Autonomía, el territorio de la Comunitat Valenciana, respecto de Alicante, Castellón y Valencia comprende sus:","Municipios","Mancomunidades","Territorios históricos","Comarcas","A"
"19","La Senyera descrita en el Estatuto de Autonomía es definida en el articulado del mismo como:","Tradicional","Simbólica","Conjunción de tradición y modernidad","Honorable","A"
"20","El Estatuto de Autonomía se refiere a sí mismo respecto a la Comunitat Valenciana como:","Su Constitución","Su ley orgánica","Su norma institucional básica","Su ley democrática fundamental","C"
"21","La Comunitat Valenciana garantiza:","La sociedad democrática avanzada","La sociedad democrática y social","El esfuerzo común de todos sus ciudadanos en la realización de sus fines","La participación de todos sus ciudadanos en la realización de sus fines","D"
"22","Las instituciones de la Generalitat podrán reunirse:","Únicamente en las sedes que determina concretamente el Estatuto de Autonomía","En cualquier municipio de la Comunitat conforme con lo que la ley disponga","Únicamente en las ciudades que determina concretamente el Estatuto de Autonomía","En cualquier ciudad de la Comunitat conforme con lo que la ley disponga","B"
"23","La vecindad a que se refiere el Estatuto para que él español residente en el extranjero pueda disfrutar de los derechos políticos que reconoce el mismo se refiere:","A cualquiera de las que hayan tenido a lo largo de su vida","A la última que hayan tenido","A cualquiera de los últimas que hayan tenido","A cualquiera de las que hayan podido obtener a lo largo de su vida","B"
"24","El pueblo valenciano al constituirse en Comunidad Autónoma ejerce:","Su autodeterminación","Su derecho a la soberanía","La expresión de su identidad histórica","Su derecho al autogobierno","D"
"25","El fondo de la Senyera es de color:","Rojo","Rojo y amarillo","Amarillo","Azul","C"
"26","El Palacio de la Generalitat se encuentra:","En la ciudad de Valencia","Donde determine la oportuna ley autonómica","En Castellón","En Alicante","A"
"27","Habrá especial protección para:","El uso del castellano en los territorios valenciano hablantes","La recuperación del valenciano","La protección de la cooficialidad","La publicación en lengua valenciana","B"
"28","Para que un descendiente de español, residente en el extranjero, tenga los derechos políticos que determina el Estatuto de Autonomía, será preciso:","Que exista declaración jurada acatando el Estatuto de Autonomía","Que esté inscrito como español","Que sus padres hayan disfrutado de tales derechos","Que tenga reconocido administrativamente la condición de emigrante","B"
"29","Respecto al valenciano, la Generalitat garantizará:","Su uso coloquial pero no oficial","Su uso normal y oficial","Exclusivamente su uso oficial","Su categoría de segunda lengua","B"
"30","La Comunitat Valenciana está definida en el Estatuto de Autonomía como:","Parte integrante de Europa","Parte de los Estados que integran Europa","Región de Europa","Parte integrante de los pueblos de Europa","C"
"31","El Estatuto de Autonomía define L 'Academia Valenciana de la Llengua como:","Institución normativa del idioma valenciano","Institución Académica del idioma valenciano","Institución científica del valenciano","Organismo público de defensa del valenciano","A"
"32","Con los Estados en los que existan comunidades de valencianos:","Tanto el Estado como la Comunitat Valenciana podrán firmar con aquellos tratados para que los valencianos puedan participar en la vida social de la Comunitat","Sólo el Estado podrá firmar con aquellos tratados para que los valencianos puedan participar en la vida social de la Comunitat","Sólo la Comunitat Valenciana podrá firmar con aquellos tratados para que los valencianos puedan participar en la vida social de la Comunitat","Todo tratado a firmar tanto el Estado como la Comunitat Valenciana con aquellos para que los valencianos puedan participar en la vida social de la Comunitat se hará en el seno de la Unión Europea","B"
"33","Respecto a la respuesta de la cuestión anterior:","No se procederá igual con los convenios que sí podrán ser firmados por las Comunitat Valenciana","No es aplicable a los convenios que se rigen por su ley estatal específica al no determinarse nada para este supuesto en el Estatuto","Se aplicará igualmente a los convenios","No se procederá igual con los convenios que sí podrán ser firmados por el Estado","C"
"34","El Título Primero del Estatuto de Autonomía consta de:","8 artículos","9 artículos","10 artículos","7 artículos","D"
"35","El Título Primero del Estatuto de Autonomía:","Consta de dos Capítulos","Consta de dos Capítulos, el primero de ellos con dos Secciones","Consta de dos Secciones","Consta de dos Capítulos, el segundo de ellos con dos Secciones","E"
"36","La recuperación del contenido de los Fueros del Antiguo Reino de Valencia se realizará:","Mediante el desarrollo legislativo respecto a las competencias que tenga la Generalitat","Mediante la recuperación cultural a practicar por todas las instituciones de la Generalitat","Mediante las normas que a tal efecto dicte el Consell","Mediante la recuperación cultural a practicar por todas las instituciones de la Comunitat Valenciana","A"
"37","Cuál de las siguientes afirmaciones es cierta:","La lengua propia de la Comunitat Valenciana es el valenciano, pero el castellano es cooficial en la misma","La lengua propia de la Comunitat Valenciana es el valenciano y el castellano, siendo ambos cooficiales","La lengua propia de la Comunitat Valenciana es el valenciano y el castellano, siendo oficial únicamente el castellano","La lengua propia de la Comunitat Valenciana es el valenciano, pero el español es cooficial en la misma","A"
"38","Qué artículo del Estatuto de Autonomía se refiere al valenciano:","Artículo 3","Artículo 8","Artículo 6","Artículo 5","C"
"39","Qué artículo del Estatuto de Autonomía se refiere a los Fueros del Antiguo Reino de Valencia:","Artículo 4","Artículo 3","Artículo 6","Artículo 8","E"
"40","Los criterios de aplicación de la lengua propia de la Comunitat en la Administración:","Será establecida por la propia Administración","Serán determinados por ley","Será determinado por el reglamento correspondiente","Se determinará en el apartado correspondiente de la Ley de la Función Pública Estatal","B"
"41","Respecto a la lengua propia de la Comunitat, la Generalitat adoptará las medidas necesarias para:","Primar su valoración","Asegurar su conocimiento","Realzar su importancia","Asegurar su utilización","B"
"42","Las normas de Derecho civil foral valenciano:","No tendrán eficacia territorial","Tendrán eficacia extraterritorial","En cuanto a su eficacia se rigen de forma distinta a las demás normas de la Generalitat","Tendrán eficacia extraterritorial salvo determinados supuestos","E"
"43","Los Fueros del Antiguo Reino de Valencia:","Se aplicarán dentro del marco de la Constitución y del Estatuto de Autonomía","Se aplicarán dentro del marco del Estatuto de Autonomía","Tendrán su aplicación únicamente limitada por la Constitución","Tendrán su aplicación limitada por la Constitución, Estatuto de Autonomía y el resto del ordenamiento jurídico","A"
"44","La aplicación de la lengua propia de la Comunitat Valenciana en la enseñanza:","Se realizará conforme al principio estatutario de primacía del valenciano","Se hará conforme los criterios que disponga la ley","Se realizará conforme al principio estatutario de exclusividad del valenciano","Se hará conforme los criterios que disponga el ordenamiento jurídico valenciano","B"
"45","Los contenidos de los Fueros del Antiguo Reino de Valencia:","No podrán aplicarse a las instituciones de la Generalitat","De manera especial se aplicarán a las instituciones de la Generalitat","Sólo podrán aplicarse a las instituciones de la Generalitat","Sólo podrán aplicarse a las instituciones de la Generalitat que determina el Estatuto de Autonomía","B"
"46","Cuál de las siguientes afirmaciones es cierta:","Las instituciones de la Generalitat podrán celebrar reuniones siempre informativas en cualquier municipio de la Comunitat Valenciana","Las instituciones de la Generalitat podrán celebrar reuniones siempre consultivas en cualquier municipio de la Comunitat Valenciana","Las instituciones de la Generalitat podrán celebrar reuniones en cualquier municipio de la Comunitat Valenciana","Las instituciones de la Generalitat podrán celebrar reuniones siempre deliberantes en cualquier municipio de la Comunitat Valenciana","C"
"47","Cuál de las siguientes afirmaciones es cierta:","Puede haber territorios de la Comunitat Valenciana excluidos de la enseñanza del valenciano, pero no de su uso","Puede haber territorios de la Comunitat Valenciana excluidos del uso del valenciano, pero no de su enseñanza","Puede haber territorios de la Comunitat Valenciana excluidos tanto del uso como de la enseñanza del valenciano","No puede haber territorios de la Comunitat Valenciana excluidos del uso ni de la enseñanza del valenciano","C"
"48","Cuál de las siguientes afirmaciones es cierta:","Puede haber territorios de la Comunitat Valenciana excluidos de la enseñanza del castellano, pero no de su uso","Puede haber territorios de la Comunitat Valenciana excluidos del uso del castellano, pero no de su enseñanza","Puede haber territorios de la Comunitat Valenciana excluidos tanto del uso como de la enseñanza del castellano","No puede haber territorios de la Comunitat Valenciana excluidos del uso ni de la enseñanza del castellano","D"
"49","El epígrafe del Título Primero es:","Ámbito de aplicación del Estatuto de Autonomía","La Comunidad Autónoma Valenciana","El pueblo valenciano","La Comunitat Valenciana","D"
"50","¿Cómo se organizó históricamente el pueblo valenciano?","En Reino de Valencia","Democráticamente","Autónomamente","Regionalmente","A"
"51","Los conflictos de leyes entre leyes estatales y leyes forales valencianas aplicables a un valenciano serán resueltos conforme a las normas establecidas:","En la Constitución","En la Constitución y en el Estatuto de Autonomía","En el Código Civil, estatal","En el ordenamiento jurídico valenciano","C"
"52","Para que los ciudadanos de la Unión Europea gocen de los mismos derechos que el Estatuto de Autonomía reconoce a los valencianos:","Será preciso que hayan optado por la nacionalidad española","Será preciso que tengan orígenes familiares en la Comunitat","Será preciso que tengan su residencia en la Comunitat","Será preciso que el Estado haya firmado un Tratado en tal sentido","C"
"53","El Estatuto de Autonomía, declara literalmente que:","Reconoce los derechos y obligaciones establecidos en la legislación europea para los ciudadanos de la Unión Europea","Asume los valores de la Unión Europea","Se adhiere a la Unión Europea","Se adhiere a los derechos y obligaciones que para sus ciudadanos reconoce la Unión Europea","B"
"54","El Estatuto de Autonomía, respecto a la bandera de la Comunitat:","Determina el escudo de la Generalitat","No determina el escudo de la Generalitat, pero sí el de las provincias de la Comunitat","No determina el escudo de la Generalitat, pero sí el del Antiguo Reino de Valencia","No determina ninguno de los escudos anteriores","D"
"55","El Estatuto de Autonomía:","Determina el escudo de la Generalitat","No determine el escudo de la Generalitat, pero sí el de las provincias de la Comunitat","No determina el escudo de la Generalitat, pero sí el del Antiguo Reino de Valencia","No determina ninguno de los escudos anteriores","D"
"56","Ante quién tiene que acreditar un español residente en el extranjero, su última vecindad valenciana para disfrutar de los derechos reconocidos en el Estatuto de Autonomía","Ante el Ministerio de Asuntos Exteriores Español","Ante el Ministerio de Asuntos Exteriores del Estado en que resida","Ante el Consulado de España en el Estado donde resida","Ante la Embajada de España en el Estado donde resida","C"
"57","Cuál de los siguientes elementos no es parte integrante de la Comunitat Valenciana:","Territorio de la misma","Ciudadanos de la misma","Organización política de la misma","Carácter de nación de la misma","D"
"58","Los derechos que podrán ser disfrutados por aquellos españoles, residentes en el extranjero, que acrediten su última vecindad valenciana son:","Derechos políticos","Derechos sociales","Derechos administrativos","Derechos autonómicos","A"
"59","Qué artículo del Estatuto de Autonomía hace referencia a la Senyera:","El 7","El 5","El 4","El 6","C"
"60","Respecto a la lengua propia de la Comunitat, el Estatuto de Autonomía:","Permite que en algunos territorios se exceptúe su enseñanza","Prohíbe que haya excepciones a la regla de la enseñanza y uso de la misma","Determina que ningún territorio de la Comunitat está excluido de la obligación de conocerla","Reconoce en determinadas personas, en razón a sus circunstancias personales y orígenes, pueden ser excluidas de la obligación de conocer y usar el valenciano","A"
"61","La simbología heráldica propia de la Comunitat Valenciana:","Tendrá que ser incorporada en cualquier lugar de la Senyera","Deberá ser incorporada en la franja azul de la Senyera","Tendrá que ser incorporada sobre las barras de la Senyera","No tiene que ser incorporada necesariamente a la Senyera","D"
