"id","pregunta","a","b","c","d","correcta"
"135","Los registros generales de apoderamientos:","No impedirán la probable existencia de registros particulares en cada Organismo donde se inscriban los poderes otorgados para la realización de trámites específicos en el mismo.","No impedirán la dudosa existencia de registros particulares en cada Organismo donde se inscriban los poderes otorgados para la realización de trámites específicos en el mismo.","No impedirán la inexistencia de registros particulares en cada Organismo donde se inscriban los poderes otorgados para la realización de trámites específicos en el mismo.","Ninguna de las respuestas es correcta.","D"
"136","Se incrementa la seguridad jurídica de los interesados estableciendo nuevas medidas que garanticen el conocimiento de la puesta a disposición de las notificaciones como el envío de avisos de notificación, siempre que esto sea posible, a los dispositivos electrónicos y/o a la dirección de correo electrónico que el interesado haya comunicado, así como el acceso a sus notificaciones:","A través del Punto de Acceso Especial Electrónico de la Administración que funcionará como un portal de entrada.","A través del Punto de Acceso General Electrónico de la Administración que funcionará como un portal de entrada.","A través del Oficina de presentación de la Administración que funcionará como un portal de entrada.","Ninguna de las respuestas es correcta.","B"
"137","Los actos de instrucción necesarios para la determinación, conocimiento y comprobación de los hechos en virtud de los cuales deba pronunciarse la resolución, se realizarán:","A solicitud de los interesados o de oficio y a través de medios electrónicos, por el órgano que tramite el procedimiento, sin perjuicio del derecho de los interesados a proponer aquellas actuaciones que requieran su intervención o constituyan trámites legal o reglamentariamente establecidos.","A solicitud de los interesados y a través de medios electrónicos, por el órgano que tramite el procedimiento, sin perjuicio del derecho de los interesados a proponer aquellas actuaciones que requieran su intervención o constituyan trámites legal o reglamentariamente establecidos.","De oficio y a través de medios electrónicos, por el órgano que tramite el procedimiento, sin perjuicio del derecho de los interesados a proponer aquellas actuaciones que requieran su intervención o constituyan trámites legal o reglamentariamente establecidos.","Ninguna de las respuestas es correcta.","C"
"138","Los actos administrativos que impongan una obligación personalísima de no hacer o soportar podrán ser ejecutados por compulsión directa:","Sobre las personas y bienes en los casos en que la ley expresamente lo autorice, y dentro siempre del respeto debido a su dignidad y a los derechos reconocidos en la Constitución.","Sobre las personas en los casos en que la ley expresamente lo autorice, y dentro siempre del respeto debido a su dignidad y a los derechos reconocidos en la Constitución.","Sobre los bienes en los casos en que la ley expresamente lo autorice, y dentro siempre del respeto debido a su dignidad y a los derechos reconocidos en la Constitución.","Ninguna de las respuestas es correcta.","B"
"139","El silencio tendrá efecto desestimatorio en los procedimientos relativos al ejercicio del derecho de petición, a que se refiere el artículo 29 de la Constitución, aquellos cuya:","Estimación o desestimación tuviera como consecuencia que se transfirieran al solicitante o a terceros facultades relativas al dominio público o al servicio público, impliquen el ejercicio de actividades que puedan dañar el medio ambiente y en los procedimientos de responsabilidad patrimonial de las Administraciones Públicas.","Desestimación tuviera como consecuencia que se transfirieran al solicitante o a terceros facultades relativas al dominio público o al servicio público, impliquen el ejercicio de actividades que puedan dañar el medio ambiente y en los procedimientos de responsabilidad patrimonial de las Administraciones Públicas.","Estimación tuviera como consecuencia que se transfirieran al solicitante o a terceros facultades relativas al dominio público o al servicio público, impliquen el ejercicio de actividades que puedan dañar el medio ambiente y en los procedimientos de responsabilidad patrimonial de las Administraciones Públicas.","Ninguna de las respuestas es correcta.","C"
"140","Se establece, con carácter básico, un conjunto mínimo de categorías:","De medios de identificación y firma electrónica a utilizar por todas las Administraciones.","De medios de firma electrónica a utilizar por todas las Administraciones.","De medios de identificación y firma a utilizar por todas las Administraciones.","Ninguna de las respuestas es correcta.","C"
"141","Cuando las Administraciones Públicas decidan iniciar:","A solicitud del interesado o de oficio un procedimiento de responsabilidad patrimonial será necesario que no haya prescrito el derecho a la reclamación del interesado al que se refiere el artículo 67.","A solicitud del interesado un procedimiento de responsabilidad patrimonial será necesario que no haya prescrito el derecho a la reclamación del interesado al que se refiere el artículo 67.","De oficio un procedimiento de responsabilidad patrimonial será necesario que no haya prescrito el derecho a la reclamación del interesado al que se refiere el artículo 67.","Ninguna de las respuestas es correcta.","C"
"142","En la resolución no se podrán aceptar hechos distintos de los determinados en el curso del procedimiento, con independencia:","De su igual o superior valoración jurídica.","De su igual o inferior valoración jurídica.","De su diferente valoración jurídica.","Ninguna de las respuestas es correcta.","C"
"143","Cuando se trate de informes:","Potestativos ya elaborados por un órgano administrativo distinto al que tramita el procedimiento, estos deberán ser remitidos en el plazo de diez días a contar desde su solicitud.","Facultativos ya elaborados por un órgano administrativo distinto al que tramita el procedimiento, estos deberán ser remitidos en el plazo de diez días a contar desde su solicitud.","Preceptivos ya elaborados por un órgano administrativo distinto al que tramita el procedimiento, estos deberán ser remitidos en el plazo de diez días a contar desde su solicitud.","Ninguna de las respuestas es correcta.","C"
"144","La lengua de los procedimientos tramitados:","Por la Administración de las Comunidades Autónomas será el castellano.","Por la Administración General del Estado será el castellano.","Por la Administración Independiente será el castellano.","Ninguna de las respuestas es correcta.","B"
"145","Los actos administrativos que impongan una obligación personalísima de no hacer o soportar podrán ser ejecutados por compulsión directa sobre las personas en los casos en que la ley expresamente lo autorice, y dentro siempre del respeto debido a su dignidad:","Y a los bienes y derechos reconocidos en la Constitución.","Y a los derechos reconocidos en la Constitución.","Y a los bienes reconocidos en la Constitución.","Ninguna de las respuestas es correcta.","B"
"146","A todos los efectos, la Administración General del Estado, las Comunidades Autónomas:","Y las Administraciones de las Comunidades Autónomas y de las Entidades Locales podrán realizar copias auténticas mediante funcionario habilitado o mediante actuación administrativa automatizada.","Y las Administraciones de las Comunidades Autónomas podrán realizar copias auténticas mediante funcionario habilitado o mediante actuación administrativa automatizada.","Y las Entidades Locales podrán realizar copias auténticas mediante funcionario habilitado o mediante actuación administrativa automatizada.","Ninguna de las respuestas es correcta.","C"
"147","Cuando en materia de procedimiento administrativo la iniciativa normativa establezca:","Actos o trámites adicionales o distintos a los contemplados en esta Ley, éstos deberán ser justificados atendiendo a la singularidad de la materia o a los fines perseguidos por la propuesta.","Trámites adicionales o distintos a los contemplados en esta Ley, éstos deberán ser justificados atendiendo a la singularidad de la materia o a los fines perseguidos por la propuesta.","Actos adicionales o distintos a los contemplados en esta Ley, éstos deberán ser justificados atendiendo a la singularidad de la materia o a los fines perseguidos por la propuesta.","Ninguna de las respuestas es correcta.","B"
"148","En los procedimientos de naturaleza sancionadora, las peticiones deberán especificar, en la medida de lo posible, la persona o personas presuntamente responsables; las conductas o hechos:","Que pudieran constituir infracción jurisdicción contenciosa y su tipificación; así como el lugar, la fecha, fechas o período de tiempo continuado en que los hechos se produjeron.","Que pudieran constituir infracción jurisdicción penal y su tipificación; así como el lugar, la fecha, fechas o período de tiempo continuado en que los hechos se produjeron.","Que pudieran constituir infracción jurisdicción civil y su tipificación; así como el lugar, la fecha, fechas o período de tiempo continuado en que los hechos se produjeron.","Ninguna de las respuestas es correcta.","D"
"149","Cuando la condición:","De interesado o ciudadano que sea parte derivase de alguna relación jurídica transmisible, el derechohabiente sucederá en tal condición cualquiera que sea el estado del procedimiento.","De ciudadano que sea parte derivase de alguna relación jurídica transmisible, el derechohabiente sucederá en tal condición cualquiera que sea el estado del procedimiento.","De interesado derivase de alguna relación jurídica transmisible, el derechohabiente sucederá en tal condición cualquiera que sea el estado del procedimiento.","Ninguna de las respuestas es correcta.","C"
"150","Si la solicitud de iniciación no reúne los requisitos que señala el artículo 66, y, en su caso, los que señala el artículo 67 u otros exigidos por la legislación específica aplicable, se requerirá:","Al interesado o ciudadano que sea parte para que, en un plazo de diez días, subsane la falta o acompañe los documentos preceptivos, con indicación de que, si así no lo hiciera, se le tendrá por desistido de su petición, previa resolución que deberá ser dictada en los términos previstos en el artículo 21.","Al ciudadano que sea parte para que, en un plazo de diez días, subsane la falta o acompañe los documentos preceptivos, con indicación de que, si así no lo hiciera, se le tendrá por desistido de su petición, previa resolución que deberá ser dictada en los términos previstos en el artículo 21.","Al interesado para que, en un plazo de diez días, subsane la falta o acompañe los documentos preceptivos, con indicación de que, si así no lo hiciera, se le tendrá por desistido de su petición, previa resolución que deberá ser dictada en los términos previstos en el artículo 21.","Ninguna de las respuestas es correcta.","C"
"151","En los casos en que proceda reconocer derecho a indemnización por anulación:","En vía administrativa o contencioso-administrativa de un acto o disposición de carácter general, el derecho a reclamar prescribirá al año de haberse notificado la resolución administrativa o la sentencia definitiva.","En vía judicial o contencioso-administrativa de un acto o disposición de carácter general, el derecho a reclamar prescribirá al año de haberse notificado la resolución administrativa o la sentencia definitiva.","En vía penal o contencioso-administrativa de un acto o disposición de carácter general, el derecho a reclamar prescribirá al año de haberse notificado la resolución administrativa o la sentencia definitiva.","Ninguna de las respuestas es correcta.","A"
"152","Los plazos expresados:","Por semanas se contarán de hora en hora y de minuto en minuto desde la hora y minuto en que tenga lugar la notificación o publicación del acto de que se trate y no podrán tener una duración superior a veinticuatro horas, en cuyo caso se expresarán en días.","Por minutos se contarán de hora en hora y de minuto en minuto desde la hora y minuto en que tenga lugar la notificación o publicación del acto de que se trate y no podrán tener una duración superior a veinticuatro horas, en cuyo caso se expresarán en días.","Por días se contarán de hora en hora y de minuto en minuto desde la hora y minuto en que tenga lugar la notificación o publicación del acto de que se trate y no podrán tener una duración superior a veinticuatro horas, en cuyo caso se expresarán en días.","Ninguna de las respuestas es correcta.","D"
"153","La ampliación de los plazos por el tiempo:","Máximo aunque susceptible de ampliación permitido se aplicará en todo caso a los procedimientos tramitados por las misiones diplomáticas y oficinas consulares, así como a aquellos que, sustanciándose en el interior, exijan cumplimentar algún trámite en el extranjero o en los que intervengan interesados residentes fuera de España.","Mínimo permitido se aplicará en todo caso a los procedimientos tramitados por las misiones diplomáticas y oficinas consulares, así como a aquellos que, sustanciándose en el interior, exijan cumplimentar algún trámite en el extranjero o en los que intervengan interesados residentes fuera de España.","Máximo permitido se aplicará en todo caso a los procedimientos tramitados por las misiones diplomáticas y oficinas consulares, así como a aquellos que, sustanciándose en el interior, exijan cumplimentar algún trámite en el extranjero o en los que intervengan interesados residentes fuera de España.","Ninguna de las respuestas es correcta.","C"
"154","La oposición a los restantes actos de trámite podrá alegarse por los interesados para su consideración en la resolución:","Que inicie o ponga fin al procedimiento.","Que ponga fin al procedimiento.","Que inicie al procedimiento.","Ninguna de las respuestas es correcta.","B"
"155","Cuando el recurso de alzada se haya interpuesto:","Contra la estimación o desestimación por silencio administrativo de una solicitud por el transcurso del plazo, se entenderá estimado el mismo si, llegado el plazo de resolución, el órgano administrativo competente no dictase y notificase resolución expresa, siempre que no se refiera a las materias enumeradas en el párrafo anterior de este apartado.","Contra la desestimación por silencio administrativo de una solicitud por el transcurso del plazo, se entenderá estimado el mismo si, llegado el plazo de resolución, el órgano administrativo competente no dictase y notificase resolución expresa, siempre que no se refiera a las materias enumeradas en el párrafo anterior de este apartado.","Contra la estimación por silencio administrativo de una solicitud por el transcurso del plazo, se entenderá estimado el mismo si, llegado el plazo de resolución, el órgano administrativo competente no dictase y notificase resolución expresa, siempre que no se refiera a las materias enumeradas en el párrafo anterior de este apartado.","Ninguna de las respuestas es correcta.","B"
"156","El certificado se expedirá de oficio por el órgano competente para resolver en el plazo de quince días desde que expire:","El plazo mínimo y máximo para resolver el procedimiento.","El plazo mínimo para resolver el procedimiento.","El plazo máximo para resolver el procedimiento.","Ninguna de las respuestas es correcta.","C"
"157","La desestimación por silencio:","Tanto administrativo como penal tiene los solos efectos de permitir a los interesados la interposición del recurso administrativo o contencioso-administrativo que resulte procedente.","Tanto penal como civil tiene los solos efectos de permitir a los interesados la interposición del recurso administrativo o contencioso-administrativo que resulte procedente.","Administrativo tiene los solos efectos de permitir a los interesados la interposición del recurso administrativo o contencioso-administrativo que resulte procedente.","Ninguna de las respuestas es correcta.","C"
"158","Las reducciones, deberán estar determinadas en la notificación de iniciación del procedimiento y su efectividad estará condicionada:","Al desistimiento o renuncia de cualquier acción o recurso en vía administrativa contra la sanción.","La aceptación o renuncia de cualquier acción o recurso en vía administrativa contra la sanción.","Al renuncia de cualquier acción o recurso en vía administrativa contra la sanción.","Ninguna de las respuestas es correcta.","A"
"159","A todos los efectos, the interesado deberá indicar en qué momento y ante qué órgano administrativo presentó los citados documentos, debiendo las Administraciones Públicas recabarlos:","Presencial o electrónicamente a través de sus redes corporativas o de una consulta a las plataformas de intermediación de datos u otros sistemas electrónicos habilitados al efecto, salvo que conste en el procedimiento la oposición expresa del interesado o la ley especial aplicable requiera su consentimiento expreso.","Electrónicamente a través de sus redes corporativas o de una consulta a las plataformas de intermediación de datos u otros sistemas electrónicos habilitados al efecto, salvo que conste en el procedimiento la oposición expresa del interesado o la ley especial aplicable requiera su consentimiento expreso.","Presencialmente a través de sus redes corporativas o de una consulta a las plataformas de intermediación de datos u otros sistemas electrónicos habilitados al efecto, salvo que conste en el procedimiento la oposición expresa del interesado o la ley especial aplicable requiera su consentimiento expreso.","Ninguna de las respuestas es correcta.","B"
"160","Si el interesado interpusiera recurso contencioso-administrativo, solicitando:","La interpretación del acto objeto del proceso, se mantendrá la suspensión hasta que se produzca el correspondiente pronunciamiento judicial sobre la solicitud.","La modificación del acto objeto del proceso, se mantendrá la suspensión hasta que se produzca el correspondiente pronunciamiento judicial sobre la solicitud.","La suspensión del acto objeto del proceso, se mantendrá la suspensión hasta que se produzca el correspondiente pronunciamiento judicial sobre la solicitud.","Ninguna de las respuestas es correcta.","C"
"161","A fin de garantizar el principio de seguridad jurídica, la iniciativa normativa se ejercerá de manera:","Comprensible o incomprensible con el resto del ordenamiento jurídico, nacional y de la Unión Europea, para generar un marco normativo estable, predecible, integrado, claro y de certidumbre, que facilite su conocimiento y comprensión y, en consecuencia, la actuación y toma de decisiones de las personas y empresas.","Incomprensible con el resto del ordenamiento jurídico, nacional y de la Unión Europea, para generar un marco normativo estable, predecible, integrado, claro y de certidumbre, que facilite su conocimiento y comprensión y, en consecuencia, la actuación y toma de decisiones de las personas y empresas.","Coherente con el resto del ordenamiento jurídico, nacional y de la Unión Europea, para generar un marco normativo estable, predecible, integrado, claro y de certidumbre, que facilite su conocimiento y comprensión y, en consecuencia, la actuación y toma de decisiones de las personas y empresas.","Ninguna de las respuestas es correcta.","C"
"162","Los medios o soportes en que se almacenen documentos, deberán contar con medidas de seguridad, de acuerdo con lo previsto en el Esquema Nacional de Seguridad, que garanticen:","La integridad, autenticidad, confidencialidad, calidad, protección y conservación de los documentos almacenados.","La integridad, autenticidad y confidencialidad de los documentos almacenados.","La autenticidad y conservación de los documentos almacenados.","Ninguna de las respuestas es correcta.","A"
"163","En todo caso, las Administraciones Públicas informarán a los interesados:","Del plazo mínimo o máximo establecido para la resolución de los procedimientos and para la notificación de los actos que les pongan término, así como de los efectos que pueda producir el silencio administrativo.","Del plazo máximo establecido para la resolución de los procedimientos y para la notificación de los actos que les pongan término, así como de los efectos que pueda producir el silencio administrativo.","Del plazo mínimo establecido para la resolución de los procedimientos y para la notificación de los actos que les pongan término, así como de los efectos que pueda producir el silencio administrativo.","Ninguna de las respuestas es correcta.","B"
"164","Las copias que aporten los interesados:","Al procedimiento tanto administrativo como penal tendrán eficacia, exclusivamente en el ámbito de la actividad de las Administraciones Públicas.","Al procedimiento tanto penal como civil tendrán eficacia, exclusivamente en el ámbito de la actividad de las Administraciones Públicas.","Al procedimiento administrativo tendrán eficacia, exclusivamente en el ámbito de la actividad de las Administraciones Públicas.","Ninguna de las respuestas es correcta.","C"
"165","Todas las notificaciones que se practiquen en papel deberán ser puestas:","A disposición del interesado o ciudadano que sea parte en la sed electrónica de la Administración u Organismo actuante para que pueda acceder al contenido de las mismas de forma voluntaria.","A disposición del ciudadano que sea parte en la sed electrónica de la Administración u Organismo actuante para que pueda acceder al contenido de las mismas de forma voluntaria.","A disposición del interesado en la sed electrónica de la Administración u Organismo actuante para que pueda acceder al contenido de las mismas de forma voluntaria.","Ninguna de las respuestas es correcta.","C"
"166","Sin perjuicio de la consulta previa a la redacción del texto de la iniciativa:","Cuando la norma afecte a los bienes y derechos e intereses legítimos de las personas, el centro directivo competente publicará el texto en el portal web correspondiente, con el objeto de dar audiencia a los ciudadanos afectados y recabar cuantas aportaciones adicionales puedan hacerse por otras personas o entidades.","Cuando la norma afecte a los derechos e intereses legítimos de las personas, el centro directivo competente publicará el texto en el portal web correspondiente, con el objeto de dar audiencia a los ciudadanos afectados y recabar cuantas aportaciones adicionales puedan hacerse por otras personas o entidades.","Cuando la norma afecte a los bienes e intereses legítimos de las personas, el centro directivo competente publicará el texto en el portal web correspondiente, con el objeto de dar audiencia a los ciudadanos afectados y recabar cuantas aportaciones adicionales puedan hacerse por otras personas o entidades.","Ninguna de las respuestas es correcta.","B"
"167","Las Administraciones Públicas, a través de sus órganos competentes en cada caso, podrán proceder, previo apercibimiento, a la ejecución forzosa de los actos administrativos, salvo en los supuestos en que se suspenda la ejecución de acuerdo con la Ley, o cuando la Constitución:","O el Real Decreto exijan la intervención de un órgano judicial.","O el Decreto Ley exijan la intervención de un órgano judicial.","O el Reglamento exijan la intervención de un órgano judicial.","Ninguna de las respuestas es correcta.","D"
"168","Antes de la iniciación del procedimiento administrativo, el órgano competente para iniciar o instruir:","El procedimiento, a solicitud del interesado o de oficio o a instancia de parte, en los casos de urgencia inaplazable y para la protección provisional de los intereses implicados, podrá adoptar de forma motivada las medidas provisionales que resulten necesarias y proporcionadas.","El procedimiento, a solicitud del interesado o a instancia de parte, en los casos de urgencia inaplazable y para la protección provisional de los intereses implicados, podrá adoptar de forma motivada las medidas provisionales que resulten necesarias y proporcionadas.","El procedimiento, de oficio o a instancia de parte, en los casos de urgencia inaplazable y para la protección provisional de los intereses implicados, podrá adoptar de forma motivada las medidas provisionales que resulten necesarias y proporcionadas.","Ninguna de las respuestas es correcta.","C"
"169","Los actos de instrucción necesarios para la determinación, conocimiento y comprobación de los hechos en virtud de los cuales deba pronunciarse la resolución, se realizarán de oficio y a través de medios electrónicos, por el órgano que tramite el procedimiento, sin perjuicio del derecho de los interesados:","A proponer aquellas actuaciones que requieran su intervención o constituyan trámites legal o reglamentariamente establecidos.","A sustituir aquellas actuaciones que requieran su intervención o constituyan trámites legal o reglamentariamente establecidos.","A cancelar aquellas actuaciones que requieran su intervención o constituyan trámites legal o reglamentariamente establecidos.","Ninguna de las respuestas es correcta.","A"
"170","Este título incorpora a las fases:","De iniciación, ordenación, instrucción y finalización del procedimiento el uso generalizado y obligatorio de medios electrónicos.","De finalización del procedimiento el uso generalizado y obligatorio de medios electrónicos.","De iniciación del procedimiento el uso generalizado y obligatorio de medios electrónicos.","Ninguna de las respuestas es correcta.","A"
