"id","pregunta","a","b","c","d","correcta"
"1","La actual Ley de Prevención de Riesgos Laborales es la:","Ley 31/1995, de 18 de noviembre, de prevención de Riesgos Laborales.","Ley 31/1995, de 8 de noviembre, de prevención de Riesgos Laborales.","Ley Orgánica 3/2007, de 22 de marzo, de prevención de Riesgos Laborales.","Real Decreto Legislativo 5/2015, de 30 de octubre, por el que se aprueba el texto refundido de la Ley de prevención de Riesgos Laborales.","B"
"2","La actual Ley de Prevención de Riesgos Laborales está amparada por el título competencial dado en la Constitución Española de 1978 en su:","Artículo 39.2.","Artículo 35.","Artículo 40.2","Artículo 50.","C"
"3","La estructura de la actual Ley de Prevención de Riesgos Laborales está constituida por:","Cinco capítulos, diecisiete disposiciones adicionales, dos disposiciones transitorias, una disposición derogatoria y dos disposiciones finales.","Seis capítulos, diecisiete disposiciones adicionales, dos disposiciones transitorias, una disposición derogatoria y dos disposiciones finales.","Siete capítulos, diez disposiciones adicionales, dos disposiciones transitorias, una disposición derogatoria y dos disposiciones finales.","Siete capítulos, diecisiete disposiciones adicionales, dos disposiciones transitorias, una disposición derogatoria y dos disposiciones finales.","D"
"4","El objeto y carácter de la norma de la actual LPRL está contenido en su artículo:","Uno.","Dos.","Tres.","Cuatro.","B"
"6","La LPRL actualiza la normativa anterior en relación a la prevención de riesgos laborales y transpone principalmente al Derecho español la siguiente directiva europea:","Directiva Europea 189/391/CEE, relativa a la aplicación de las medidas para promover la mejora de la seguridad y de la salud de los trabajadores en el trabajo.","Directiva Europea 89/391/CEE, relativa a la aplicación de las medidas para promover la mejora de la seguridad y de la salud de los trabajadores en el trabajo.","Directiva Europea 89/1391/CEE, relativa a la aplicación de las medidas para promover la mejora de la seguridad y de la salud de los trabajadores en el trabajo.","Directiva Europea 890/39/CEE, relativa a la aplicación de las medidas para promover la mejora de la seguridad y de la salud de los trabajadores en el trabajo.","B"
"7","Una importante modificación y actualización de la LPRL ha sido:","El Real Decreto Legislativo 5/2015 de 30 de octubre, por el que se aprueba el texto refundido de la Ley del Estatuto Básico del Empleado Público.","La Ley Orgánica 3/2007, de 22 de marzo, de reforma del marco normativo de la prevención de riesgos laborales.","La Ley 54/2003, de 12 de diciembre, de reforma del marco normativo de la prevención de riesgos laborales.","Ninguna de las respuestas anteriores es correcta.","C"
"8","La adaptación de la LPRL a las peculiaridades propias de la Administración General del Estado se hizo a través de la siguiente norma:","Real Decreto 67/2010, de 29 de enero, de adaptación de la legislación de Prevención de Riesgos Laborales a la Administración General del Estado.","Real Decreto 167/2010, de 29 de enero, de adaptación de la legislación de Prevención de Riesgos Laborales a la Administración General del Estado.","Real Decreto 67/2015, de 29 de enero, de adaptación de la legislación de Prevención de Riesgos Laborales a la Administración General del Estado.","Ninguna de las respuestas anteriores es correcta.","A"
"9","La LPRL dedica a los derechos y obligaciones en materia de prevención de riesgos laborales su capítulo:","Uno.","Dos.","Tres.","Cuatro.","C"
"11","Indique cuál de los siguientes textos jurídicos introduce modificaciones en el articulado de la LPRL:","Ley Orgánica 3/2007, de 22 de marzo, para la igualdad efectiva de mujeres y hombres.","Ley 25/2009, de 22 de diciembre, de modificación de diversas leyes para su adaptación a la Ley sobre el libre acceso a las actividades de servicios y su ejercicio","El Real Decreto Legislativo 5/2015, de 30 de octubre, por el que se aprueba el texto refundido de la Ley del Estatuto Básico del Empleado Público.","Las respuestas a y b son correctas.","D"
"12","La LPRL dedica a las responsabilidades y sanciones en materia de prevención de riesgos laborales su:","Capítulo IV.","Capítulo V.","Capítulo VII.","Capítulo VIII.","C"
"13","Según el artículo 1 de la LPRL la normativa sobre prevención de riesgos laborales está constituida por:","La LPRL.","Las disposiciones de desarrollo o complementarias.","Cuantas normas, legales o convencionales, contengan prescripciones relativas a la adopción de medidas preventivas en el ámbito laboral o susceptibles de producirlas en dicho ámbito.","Todas las respuestas anteriores son correctas.","D"
"14","La LPRL tiene por objeto:","La información, la consulta y la participación equilibrada en la formación de los trabajadores en materia preventiva.","Promover la seguridad y la salud de los trabajadores mediante la aplicación de medidas y el desarrollo de las actividades necesarias para la prevención de riesgos derivados del trabajo.","Regular las actuaciones a desarrollar por las Administraciones Públicas, así como por los empresarios, los trabajadores y sus respectivas organizaciones representativas para alcanzar los fines contemplados en esta ley.","Las respuestas b y c son correctas.","D"
"15","En la LPRL se establecen los principios generales relativos a:","La prevención de los riesgos profesionales para la protección de la seguridad y de la salud.","La eliminación o disminución de los riesgos derivados del trabajo.","La formación de los trabajadores en materia preventiva.","Todas las respuestas anteriores son correctas.","D"
"16","La LPRL y sus normas de desarrollo serán de aplicación:","En el ámbito de las relaciones laborales reguladas en el texto refundido de la Ley del Estatuto de los Trabajadores.","En el ámbito de las relaciones de carácter administrativo o estatutario del personal al servicio de las Administraciones Públicas, con las peculiaridades que, en este caso, se contemplan en la presente Ley o en sus normas de desarrollo.","A las sociedades cooperativas, constituidas de acuerdo con la legislación que les sea de aplicación, en las que existan socios cuya actividad consista en la prestación de un trabajo personal, con las peculiaridades derivadas de su normativa específica.","Todas las respuestas anteriores son correctas.","D"
"17","Señale la respuesta incorrecta. La presente Ley no será de aplicación en aquellas actividades cuyas particularidades lo impidan en el ámbito de las funciones públicas de:","Policía, seguridad y resguardo aduanero.","Servicios operativos de protección civil y peritaje forense en los casos de grave riesgo, catástrofe y calamidad pública.","Las relaciones de carácter administrativo o estatutario del personal al servicio de las Administraciones Públicas, con las peculiaridades que, en este caso, se contemplan en la presente Ley o en sus normas de desarrollo.","Las Fuerzas Armadas y actividades militares de la Guardia Civil.","C"
"18","Señale la afirmación incorrecta:","En los centros y establecimientos militares será de aplicación lo dispuesto en la LPRL, con las particularidades previstas en su normativa específica.","La LPRL será de aplicación a la relación laboral de carácter especial del servicio del hogar familiar","En los establecimientos penitenciarios, se adaptarán a la LPRL aquellas actividades cuyas características justifiquen una regulación especial.","El ámbito de aplicación de la LPRL está desglosado en el artículo 3 de dicha ley.","B"
"19","A efectos de la presente Ley y de las normas que la desarrollen se entenderá por prevención:","El conjunto de actividades o medidas adoptadas o previstas en todas las fases de actividad de la empresa con el fin de evitar o disminuir los riesgos derivados del trabajo","La posibilidad de que un trabajador sufra un determinado daño derivado del trabajo. Para calificar un riesgo desde el punto de vista de su gravedad, se valorarán conjuntamente la probabilidad de que se produzca el daño y la severidad del mismo.","Las enfermedades, patologías o lesiones sufridas con motivo u ocasión del trabajo.","Aquel que resulte probable racionalmente que se materialice en un futuro inmediato y pueda suponer un daño grave para la salud de los trabajadores","A"
"20","A efectos de la presente Ley y de las normas que la desarrollen se entenderá por riesgo laboral:","La posibilidad de que un trabajador sufra un determinado daño derivado del trabajo. Para calificar un riesgo desde el punto de vista de su gravedad, se valorarán conjuntamente la probabilidad de que se produzca el daño y la severidad del mismo.","Las enfermedades, patologías o lesiones sufridas con motivo u ocasión del trabajo.","Aquel que resulte probable racionalmente que se materialice en un futuro inmediato y pueda suponer un daño leve o grave para la salud de los trabajadores.","El conjunto de actividades o medidas adoptadas o previstas en todas las fases de actividad de la empresa con el fin de evitar o disminuir los riesgos derivados del trabajo.","A"
"21","A efectos de la presente Ley y de las normas que la desarrollen se entenderá por daños derivados del trabajo:","El conjunto de actividades o medidas adoptadas o previstas en todas las fases de actividad de la empresa con el fin de evitar o disminuir los riesgos derivados del trabajo.","La posibilidad de que un trabajador sufra un determinado daño derivado del trabajo. Para calificar un riesgo desde el punto de vista de su gravedad, se valorarán conjuntamente la probabilidad de que se produzca el daño y la severidad del mismo.","Las enfermedades, patologías o lesiones sufridas con motivo u ocasión del trabajo.","Aquel que resulte probable racionalmente que se materialice en un futuro inmediato y pueda suponer un daño leve para la salud de los trabajadores.","C"
"22","A efectos de la presente Ley y de las normas que la desarrollen se entenderá por riesgo laboral grave e inminente:","Aquel que resulte probable racionalmente que se materialice en un futuro inmediato y pueda suponer un daño leve o grave para la salud de los trabajadores.","Aquel que resulte probable racionalmente que se materialice en un futuro inmediato y pueda suponer un daño grave para la salud de los trabajadores.","La posibilidad de que un trabajador sufra un determinado daño derivado del trabajo. Para calificar un riesgo desde el punto de vista de su gravedad, se valorarán conjuntamente la probabilidad de que se produzca el daño y la severidad del mismo.","Las enfermedades, patologías o lesiones sufridas con motivo u ocasión del trabajo.","B"
"23","En el caso de exposición a agentes susceptibles de causar daños graves a la salud de los trabajadores, se considerará que existe un riesgo grave e inminente cuando:","Sea probable intuitivamente que se materialice en un futuro inmediato una exposición a dichos agentes de la que puedan derivarse daños graves para la salud, aun cuando éstos no se manifiesten de forma inmediata.","Sea probable racionalmente que se materialice en un futuro inmediato una exposición a dichos agentes de la que puedan derivarse daños leves o graves para la salud, y ya hay indicios leves de su manifestación.","Sea probable racionalmente que se materialice en un futuro inmediato una exposición a dichos agentes de la que puedan derivarse daños graves para la salud, aun cuando éstos no se manifiesten de forma inmediata.","Ninguna de las respuestas anteriores es correcta.","C"
"24","Se entenderán como procesos, actividades, operaciones, equipos o productos «potencialmente peligrosos» aquellos que:","En ausencia de medidas preventivas específicas, originen riesgos para la seguridad y la salud de los trabajadores que los desarrollan o utilizan.","Con la existencia de medidas preventivas específicas, originen riesgos para la seguridad y la salud de los trabajadores que los desarrollan o utilizan.","Con la existencia de medidas preventivas específicas, originen riesgos para la seguridad y la salud de los trabajadores que los desarrollan o utilizan y el medio ambiente donde se utilicen.","Ninguna de las respuestas anteriores es correcta.","A"
"25","Siguiendo el artículo 4 de la LPRL se entenderá como «equipo de trabajo»:","Cualquier indumentaria, máquina, aparato, instrumento o instalación utilizada en el trabajo","Cualquier máquina, aparato, instrumento o instalación utilizada en el trabajo","Cualquier indumentaria, máquina, aparato, instrumento, tecnología o instalación utilizada en el trabajo","Cualquier indumentaria o accesorio personal utilizado en el trabajo y necesario para su realización.","B"
"26","Según el artículo 4 de la LPRL, se entenderá como «condición de trabajo»:","Cualquier indumentaria, máquina, aparato, instrumento, tecnología o instalación utilizada en el trabajo","Cualquier característica del mismo que pueda tener una influencia significativa en la generación de las condiciones de trabajo.","Cualquier característica del mismo que pueda tener una influencia significativa en la generación de riesgos para la seguridad y la salud del trabajador.","Las respuestas a y c son correctas.","C"
"27","Señale la respuesta incorrecta. Quedan específicamente incluidas dentro de la definición de condiciones de trabajo:","Las características generales de los locales, instalaciones, equipos, productos y demás útiles existentes en el centro de trabajo.","La naturaleza de los agentes físicos, químicos y biológicos presentes en el ambiente de trabajo y sus correspondientes intensidades, concentraciones o niveles de presencia","Los procedimientos para la utilización de los agentes citados anteriormente que no influyan en la generación de los riesgos mencionados.","Todas aquellas características del trabajo, incluidas las relativas a su organización y ordenación, que influyan en la magnitud de los riesgos a que esté expuesto el trabajador","C"
"28","De conformidad con el artículo 4 de la LPRP, se entiende por «equipo de protección individual»:","Cualquier equipo destinado a ser llevado o sujetado por el trabajador para que le proteja de uno o varios riesgos que puedan amenazar su seguridad o su salud en el trabajo, así como cualquier complemento o accesorio destinado a tal fin.","Cualquier indumentaria, máquina, aparato, instrumento, tecnología o instalación utilizada en el trabajo.","Cualquier indumentaria, máquina, aparato, instrumento o instalación utilizada en el trabajo.","Cualquier indumentaria o accesorio personal utilizado en el trabajo y necesario para su realización.","A"
"69","En el artículo 14 de la LPRL se expone el derecho a la protección frente a los riesgos laborales, que consiste en:","Que los trabajadores tienen derecho a una protección eficaz en materia de seguridad y salud en el trabajo","La existencia de un correlativo deber del empresario de protección de los trabajadores frente a los riesgos laborales.","Un deber de las Administraciones Públicas respecto del personal a su servicio","Todas las respuestas anteriores son correctas.","D"
"70","Forman parte del derecho de los trabajadores a una protección eficaz en materia de seguridad y salud en el trabajo:","Los derechos de información, consulta y participación.","La formación en materia preventiva.","La paralización de la actividad en caso de riesgo grave e inminente.","Todas las respuestas anteriores son correctas.","D"
"71","Indique la afirmación correcta:","El coste de las medidas relativas a la seguridad y la salud en el trabajo no deberá recaer en modo alguno sobre los trabajadores","La vigilancia del estado de salud de los trabajadores forma parte del derecho de los trabajadores a una protección eficaz en materia de seguridad y salud en el trabajo.","En la LPRL los Derechos y obligaciones están contenidos en su capítulo IV.","Las respuestas a y b son correctas.","AD"
"72","Los principios de la acción preventiva en la LPRL están contenidos en su artículo:","Catorce.","Quince.","Dieciséis.","Diecisiete.","B"
"73","Señale la respuesta incorrecta. El empresario aplicará las medidas que integran el deber general de prevención con arreglo a los siguientes principios generales contenidos en la LPRL:","Evitar los riesgos.","Evaluar los riesgos que no se puedan evitar.","Evaluar los riesgos que se puedan evitar.","Combatir los riesgos en su origen.","C"
"74","Señale la respuesta incorrecta. El empresario aplicará las medidas que integran el deber general de prevención con arreglo a los siguientes principios generales contenidos en la LPRL:","Adoptar medidas que antepongan la protección individual a la colectiva.","Adaptar el trabajo a la persona, en particular en lo que respecta a la concepción de los puestos de trabajo, así como a la elección de los equipos y los métodos de trabajo y de producción, con miras, en particular, a atenuar el trabajo monótono y repetitivo y a reducir los efectos del mismo en la salud.","Tener en cuenta la evolución de la técnica.","Sustituir lo peligroso por lo que entrañe poco o ningún peligro.","A"
"75","Señale la respuesta incorrecta. El empresario aplicará las medidas que integran el deber general de prevención con arreglo a los siguientes principios generales contenidos en la LPRL:","Planificar la prevención, buscando un conjunto coherente que integre en ella la técnica, la organización del trabajo, las condiciones de trabajo, las relaciones sociales y la influencia de los factores ambientales en el trabajo.","Adoptar medidas que antepongan la protección colectiva a la individual.","Dar las debidas instrucciones a los trabajadores.","Sustituir lo peligroso por lo que entrañe ningún tipo de peligro.","D"
"76","Señale la afirmación correcta:","El empresario tomará en consideración las capacidades profesionales de los trabajadores en materia de seguridad y de salud en el momento de encomendarles las tareas.","El empresario adoptará las medidas necesarias a fin de garantizar que solo los trabajadores que hayan recibido información suficiente y adecuada puedan acceder a las zonas de riesgo grave y específico.","La efectividad de las medidas preventivas deberá prever las distracciones o imprudencias no temerarias que pudiera cometer el trabajador. Para su adopción se tendrán en cuenta los riesgos adicionales que pudieran implicar determinadas medidas preventivas, las cuales sólo podrán adoptarse cuando la magnitud de dichos riesgos sea sustancialmente inferior a la de los que se pretende controlar y no existan alternativas más seguras.","Todas las respuestas anteriores son correctas.","D"
"77","Señale la afirmación correcta. Según el artículo 15 de la LPRL podrán concertar operaciones de seguro que tengan como fin garantizar como ámbito de cobertura la previsión de riesgos derivados del trabajo:","La empresa respecto de sus trabajadores.","Los trabajadores autónomos respecto a ellos mismos.","Las sociedades cooperativas respecto a sus socios cuya actividad consista en la prestación de su trabajo personal.","Todas las respuestas anteriores son correctas.","D"
"78","La prevención de riesgos laborales deberá integrarse en el Sistema general de gestión de la empresa, tanto en el conjunto de sus actividades como en todos los niveles jerárquicos de ésta, a través de la implantación y aplicación de:","Un plan de emergencia empresarial.","Un plan de prevención de riesgos laborales.","Un plan de emergencias de riesgos laborales.","Un plan de evaluación y prevención de riesgos laborales.","B"
"79","Un plan de prevención de riesgos laborales deberá incluir como mínimo:","La estructura organizativa de la empresa.","Las responsabilidades, funciones, prácticas, procedimientos y procesos para realizar la acción de prevención de riesgos en la empresa.","Los recursos necesarios para realizar la acción de prevención de riesgos en la empresa.","Todas las respuestas anteriores son correctas.","D"
"80","Los instrumentos esenciales para la gestión y aplicación del plan de prevención de riesgos, que podrán ser llevados a cabo por fases de forma programada son:","La evaluación de riesgos laborales.","La planificación de la actividad preventiva.","La subsanación de los riesgos laborales.","Las respuestas a y b son correctas.","D"
"81","Indique la afirmación incorrecta en relación a la evaluación de los riesgos laborales:","El empresario deberá realizar una evaluación inicial de los riesgos para la seguridad y salud de los trabajadores, teniendo en cuenta, con carácter general, la naturaleza de la actividad, las características de los puestos de trabajo existentes y de los trabajadores que deban desempeñarlos.","No es necesario que la evaluación sea actualizada cuando cambien las condiciones de trabajo pero, en todo caso, se someterá a consideración y se revisará, si fuera necesario, con ocasión de los daños para la salud que se hayan producido.","El empresario deberá realizar una evaluación inicial de los riesgos para la seguridad y salud de los trabajadores con ocasión de la elección de los equipos de trabajo, de las sustancias o preparados químicos y del acondicionamiento de los lugares de trabajo.","La evaluación inicial tendrá en cuenta aquellas otras actuaciones que deban desarrollarse de conformidad con lo dispuesto en la normativa sobre protección de riesgos específicos y actividades de especial peligrosidad.","B"
"82","Señale la respuesta incorrecta. Si los resultados de la evaluación de los riesgos laborales pusieran de manifiesto situaciones de riesgo, el empresario realizará aquellas actividades preventivas necesarias para eliminar o reducir y controlar tales riesgos. Dichas actividades serán objeto de planificación por el empresario, incluyendo para cada actividad preventiva:","El plazo para llevarla a cabo.","La designación de responsables.","La comunicación de solicitud de inspección de la adecuación de dichas actividades preventivas.","Los recursos humanos y materiales necesarios para su ejecución.","C"
"83","Las empresas, en atención al número de trabajadores y a la naturaleza y peligrosidad de las actividades realizadas, podrán realizar el plan de prevención de riesgos laborales, la evaluación de riesgos y la planificación de la actividad preventiva:","De forma simplificada.","De forma temporal.","De forma incompleta.","De forma indefinida.","A"
"84","Cuando la utilización de un equipo de trabajo pueda presentar un riesgo específico para la seguridad y la salud de los trabajadores, el empresario adoptará las medidas necesarias con el fin de que:","La utilización del equipo de trabajo quede reservada a los encargados de dicha utilización.","Los trabajos de reparación, transformación, mantenimiento o conservación sean realizados por los trabajadores específicamente capacitados para ello.","Sea sustituido lo antes posible por un equipo de trabajo sin dicho riesgo y con las mismas funcionalidades y prestaciones.","Las respuestas a y b son correctas.","D"
"85","Señale la afirmación incorrecta respecto a los equipos de protección individuales de trabajo:","El empresario deberá proporcionar a sus trabajadores equipos de protección individual adecuados para el desempeño de sus funciones y velar por el uso efectivo de los mismos cuando, por la naturaleza de los trabajos realizados, sean necesarios.","Los equipos de protección individual deberán utilizarse cuando los riesgos puedan limitarse suficientemente por medios técnicos de protección colectiva o mediante medidas, métodos o procedimientos de organización del trabajo.","Los equipos de protección individual deberán utilizarse cuando los riesgos no puedan limitarse suficientemente por medios técnicos de protección colectiva o mediante medidas, métodos o procedimientos de organización del trabajo.","Los equipos de protección individual deberán utilizarse cuando los riesgos no se puedan evitar.","B"
"86","Señale la respuesta correcta. Conforme al artículo 17 de la LPRL, deberán utilizarse equipos de protección individual:","Cuando los riesgos puedan limitarse suficientemente por medios técnicos de protección colectiva.","Cuando los riesgos puedan limitarse suficientemente mediante medidas, métodos o procedimientos de organización del trabajo.","Cuando los riesgos no se puedan evitar.","Todas las respuestas anteriores son correctas.","C"
"87","Señale la afirmación incorrecta. Según el artículo 18 de la LPRL y a fin de dar cumplimiento al deber de protección establecido en la presente Ley, el empresario adoptará las medidas adecuadas para que los trabajadores reciban todas las informaciones necesarias en relación con:","La normativa que en materia de seguridad y la salud de los trabajadores en el trabajo afecte a la empresa.","Los riesgos para la seguridad y la salud de los trabajadores en el trabajo, tanto aquellos que afecten a la empresa en su conjunto como a cada tipo de puesto de trabajo o función.","Las medidas y actividades de protección y prevención aplicables a los riesgos para la seguridad y la salud de los trabajadores en el trabajo, tanto aquellos que afecten a la empresa en su conjunto como a cada tipo de puesto de trabajo o función.","Las medidas adoptadas de emergencia.","A"
