"id","pregunta","a","b","c","d","correcta"
"521","Las sesiones extraordinarias de las Cámaras serán a petición de:","El Gobierno.","La Diputación Permanente.","La mayoría absoluta de los miembros de cualquiera de las Cámaras.","Todas las respuestas anteriores son correctas.","D"
"522","Señale la respuesta incorrecta en relación a las sesiones extraordinarias de las Cámaras:","Las sesiones extraordinarias deberán convocarse sobre un orden del día.","Las sesiones extraordinarias serán clausuradas una vez que el orden del día haya sido agotado.","El número de sesiones extraordinarias anuales está limitado.","Todas las respuestas anteriores son correctas.","C"
"523","Las Cámaras se reunirán en sesión conjunta para ejercer las competencias no legislativas atribuidas expresamente en su:","Título 1.","Título II.","Título III.","Título IV.","B"
"524","¿Cuáles de las siguientes decisiones de las Cortes Generales se adoptarán por mayoría simple de cada una de las Cámaras?","Algunos Tratados internacionales.","Acuerdos de Cooperación entre comunidades autónomas.","Fondo de Compensación Interterritorial.","Todas las respuestas anteriores son correctas.","D"
"525","¿Cuál de los siguientes procedimientos, previstos en el artículo 74.2, se iniciarán por el Congreso de los Diputados?","Algunos Tratados internacionales.","Acuerdos de Cooperación entre comunidades autónomas.","Fondo de Compensación Interterritorial.","Todas las respuestas anteriores son correctas.","A"
"526","Las decisiones de las Cortes Generales previstas en el artículo 74.2 de la Constitución española en las que no hubiera acuerdo entre Senado y Congreso, se intentará obtener por:","Una Comisión Mixta compuesta de diputados y senadores.","Una Comisión Mixta compuesta de igual número de diputados y senadores.","Una Comisión Paritaria compuesta de igual número de diputados y senadores.","Una Comisión Especial compuesta de diputados y senadores.","B"
"527","En las decisiones de las Cortes Generales prevista en el artículo 74.2 de la Constitución española, si finaliza el procedimiento sin acuerdo, la aprobación se decidirá por:","El Senado, por mayoría simple.","El Senado, por mayoría absoluta.","El Congreso de los Diputados, por mayoría simple.","El Congreso de los Diputados, por mayoría absoluta.","D"
"528","¿Cuál de los siguientes procedimientos, previstos en el artículo 74.2 de la Constitución española, se iniciarán por el Senado?","Algunos Tratados internacionales.","Acuerdos de Cooperación entre comunidades autónomas.","Fondo de Compensación Interterritorial.","Las respuestas by c son correctas.","D"
"529","Señale para cuál de las siguientes funciones de las Cortes Generales no es necesario que se reúnan en sesiones conjuntas ambas Cámaras;","Proveer a la sucesión de la Corona cuando se extingan todas las líneas llamadas en Derecho.","Elegir al Presidente del Gobierno.","Reconocer la imposibilidad del Rey inhabilitado.","Designar al Regente o regentes cuando no le corresponda a ninguna persona.","B"
"530","Señale para cuál de las siguientes funciones de las Cortes Generales no es necesario que se reúnan en sesiones conjuntas ambas Cámaras:","Nombrar al tutor del Rey cuando no corresponda a ninguna persona.","La proclamación del Rey.","En la votación de una moción de censura.","Autorizar al Rey a declarar la guerra o hacer la paz.","C"
"531","El Congreso de los Diputados y el Senado funcionarán:","En Plenos.","En Comisiones.","En Plenos y Comisiones.","En Sesiones.","C"
"532","Las Cámaras de las Cortes Generales podrán delegar la aprobación de proyectos o proposiciones de ley en:","Las Comisiones Informativas Permanentes.","Las Comisiones Legislativas Permanentes.","Las Comisiones Legislativas Temporales.","Las Comisiones Permanentes.","B"
"533","La figura jurídica por la que el Pleno podrá recabar en cualquier momento el debate y votación de cualquier proyecto o proposición de ley que haya sido objeto de delegación, es:","La avocación.","La delegación.","El retorno.","La dación.","A"
"534","Señale la respuesta incorrecta. Las Cámaras de las Cortes Generales podrán delegar la aprobación de proyectos o proposiciones de ley, excepto:","La reforma constitucional.","Las cuestiones internacionales.","Las leyes orgánicas y de bases.","Las leyes de armonización.","D"
"535","Las Cámaras de las Cortes Generales podrán delegar la aprobación de proyectos o proposiciones de ley, excepto:","Los reglamentos de las Cámaras.","Leyes ordinarias.","Los Presupuestos Generales del Estado.","Ninguna de las respuestas anteriores es correcta.","C"
"536","¿Cuál de las siguientes comisiones no es una Comisión e Permanente Legislativa de las Cortes?","Comisión Constitucional del Congreso.","Comisión de Asuntos Exteriores.","Comisión Mixta para la Unión Europea.","Comisión de Justicia.","C"
"537","La delegación de las Cámaras en las Comisiones Legislativas Permanentes comprende:","El debate y la aprobación.","Solo el debate.","Solo el estudio.","El estudio y el debate.","A"
"538","Las Comisiones de investigación pueden ser nombradas por:","El Congreso.","El Senado.","En su caso, ambas Cámaras conjuntamente.","Todas las respuestas anteriores son correctas.","D"
"539","Según la Constitución española podrán ser nombradas Comisiones de investigación sobre:","Cualquier asunto de interés público.","Cualquier asunto de interés general.","Cualquier asunto de interés político.","Cualquier asunto de interés de Estado.","A"
"540","Señale la respuesta incorrecta. Las conclusiones de las Comisiones de investigación:","No serán vinculantes para los tribunales.","No afectarán las resoluciones judiciales.","Son de obligatorio cumplimiento.","Pueden ser trasladadas al Ministerio Fiscal.","C"
"541","¿Es obligado comparecer a requerimiento del Congreso de los Diputados y del Senado en sus comisiones de investigación?","No es obligatorio.","Solo en determinadas ocasiones reguladas por ley.","Sí, y la ley regulará las sanciones que puedan imponerse por incumplimiento de esta obligación.","Sí, pero no se pueden imponer sanciones por incumplimiento de esta obligación.","C"
"542","¿Qué artículo de la Constitución española está dedicado a las Comisiones de Investigación?","Setenta y cinco.","Setenta y seis.","Setenta y siete.","Setenta y ocho.","B"
"543","Según el artículo 77 de la Constitución española las Cámaras pueden recibir peticiones:","Individuales.","Colectivas.","Individuales y colectivas.","Solo se pueden presentar peticiones a través de los representantes políticos.","C"
"544","Según el artículo 77 de la Constitución española las Cámaras pueden recibir peticiones:","Siempre por escrito.","Sí, pero se prohíbe la presentación directa por manifestaciones ciudadanas.","Las respuestas a y b son correctas.","Las respuestas a y b son incorrectas.","C"
"545","Las peticiones que reciban las Cámaras de las Cortes Generales:","Pueden ser debatidas y votadas en el Congreso de los Diputados.","Pueden ser debatidas y votadas en el Senado.","Pueden ser remitidas al Gobierno.","Pueden ser debatidas en una Comisión informativa formada al efecto.","C"
"546","Señale la afirmación correcta respecto a las peticiones que reciben las Cámaras:","Las Cámaras están obligadas a explicarse sobre su contenido.","Las Cámaras están obligadas a explicarse sobre su contenido, si lo exige el Gobierno.","El Gobierno está obligado a explicarse sobre su contenido, siempre que las Cámaras lo exijan.","El Gobierno está obligado a explicarse sobre su contenido.","C"
"547","La Comisión de Peticiones del Congreso de los Diputados, que acusa recibo de cada petición, es una comisión de naturaleza:","Legislativa.","No legislativa.","Mixta.","Las respuestas a y c son correctas.","A"
"548","La Diputación Permanente de cada Cámara representa a:","Los grupos parlamentarios.","Los partidos políticos.","Las Comisiones informativas.","La Mesa de las Cámaras.","A"
"549","Las Diputaciones Permanentes estarán compuestas por:","Veintiún miembros.","Un mínimo de veintiún miembros.","Veinte miembros.","Un mínimo de veinte miembros.","B"
"550","Las Diputaciones Permanentes estarán presididas por:","Un Presidente de la Diputación Permanente nombrado al efecto.","Un Presidente de la Diputación Permanente nombrado al efecto, de entre sus miembros.","El Presidente de la Mesa de la Cámara respectiva.","El Presidente de la Cámara respectiva.","D"
"551","Las Diputaciones Permanentes tendrán como funciones las previstas en los:","Artículos 72, 86 y 115.","Artículos 71, 85 y 114.","Artículos 73, 86 y 116.","Artículos 73, 83 y 113.","C"
"552","Las Diputaciones Permanentes tienen como misión principal:","Velar por los poderes de las Cámaras cuando éstas no estén reunidas.","Tramitar las leyes aprobadas por las Cámaras.","Representar a los partidos políticos.","Velar por los poderes de las Cámaras en todo momento.","A"
"553","Las Diputaciones Permanentes de las Cámaras seguirán ejerciendo sus funciones hasta la constitución de las nuevas Cortes Generales en los casos de:","Expiración del mandato de las Cortes Generales.","En caso de disolución de las Cortes Generales.","Las respuestas a y b son correctas.","Ninguna de las respuestas anteriores es correcta.","C"
"554","La representación de los grupos políticos en la Diputación Permanente de cada Cámara estará en proporción:","A los votos recibidos en las elecciones.","A la decisión de la Mesa.","A su importancia numérica.","Al número de Comisiones parlamentarias.","C"
"555","Una vez que vuelve a reunirse la Cámara correspondiente, las Diputaciones Permanentes tienen la obligación de:","Fiscalizar la correcta reunión de las Cámaras.","Hacer un balance económico-financiero de su gestión.","Asistir a los parlamentarios en lo que les reclamen.","Dar cuenta de los asuntos tratados y de sus decisiones.","D"
"556","La Diputación Permanente del Congreso de los Diputados es:","Una Comisión Legislativa permanente.","Una Comisión Legislativa no permanente.","Una Comisión Mixta de trabajo.","Un órgano de las Cortes Generales.","D"
"557","En relación a la composición de la Diputación Permanente del Congreso de los Diputados:","Cada grupo parlamentario designará el número de diputados titulares que le correspondan y otros tantos en concepto de suplentes.","Cada partido político designará el número de diputados titulares que le correspondan y otros tantos en concepto de suplentes.","Sus miembros serán elegidos por votación del Pleno del Congreso.","Sus miembros serán elegidos por la Mesa del Congreso atendiendo al número de diputados que corresponda a los grupos parlamentarios.","A"
"558","Señale la afirmación incorrecta. Según el artículo 79 de la Constitución, las Cámaras para adoptar acuerdos:","Deben estar reunidas reglamentariamente.","Deben asistir la mayoría de sus miembros.","Deben tener un Orden del Día.","Ninguna de las respuestas anteriores es correcta.","C"
"559","Para que los acuerdos de las Cámaras sean válidos deberán ser aprobados por:","La mayoría absoluta de sus miembros, con excepciones.","La mayoría de sus miembros presentes, con excepciones.","La mayoría cualificada de sus miembros, con excepciones.","La mayoría de sus miembros, con excepciones.","B"
"560","El voto de senadores y diputados es:","Personal e indelegable.","Personal y delegable.","Objetivo e indelegable.","Objetivo y delegable.","A"
"561","Según el artículo 79 de la Constitución española las mayorías especiales para votar acuerdos están determinadas en:","La Constitución.","Las leyes orgánicas.","Los reglamentos de las Cámaras, para la elección de personas.","Todas las respuestas anteriores son correctas.","D"
"562","Las sesiones plenarias de las Cámaras serán:","Públicas, salvo acuerdo en contrario de cada Cámara, adoptado por la mayoría simple o con arreglo al reglamento.","Públicas, siempre.","Públicas, salvo acuerdo en contrario de cada Cámara, adoptado por la mayoría simple.","Públicas, salvo acuerdo en contrario de cada Cámara, adoptado por la mayoría absoluta o con arreglo al reglamento.","D"
"563","Señale 'la respuesta incorrecta, Según el artículo 81 de la Constitución española son leyes orgánicas:","Las relativas al desarrollo de los derechos fundamentales y de las libertades públicas.","Las leyes relativas a la Hacienda Pública.","Las que aprueban los estatutos de autonomía.","El régimen electoral general.","B"
"564","¿Qué mayoría exigirá la aprobación, modificación o derogación de las leyes orgánicas en una votación final sobre el conjunto del proyecto?","Mayoría absoluta del Senado.","Mayoría simple del Senado.","Mayoría absoluta del Congreso.","Mayoría reforzada del Congreso.","C"
"565","Señale la respuesta correcta. Según nuestra norma fundamental las leyes orgánicas son:","Las relativas al desarrollo de los derechos y libertades recogidos en el Título I de la Constitución.","Las relativas al desarrollo de los derechos y libertades recogidos en el Capítulo 20 del Título I de la Constitución.","Las relativas al desarrollo de los derechos y libertades recogidos en la Sección 2a del Capítulo 20 del Título I de la Constitución.","Las relativas al desarrollo de los derechos y libertades recogidos en la Sección la del Capítulo 20 del Título I de la Constitución.","D"
"566","La aprobación, modificación o derogación de las leyes orgánicas:","Puede ser objeto de delegaciones legislativas.","Puede ser objeto de decretos leyes.","Solo se pueden aprobar por el Pleno del Congreso en una votación final sobre el conjunto del proyecto.","Puede ser objeto de competencia legislativa de las Comisiones del Congreso.","C"
"567","¿Cuál de las siguientes leyes del ordenamiento jurídico español no es una ley orgánica?","Del Régimen Electoral General, de 19 de junio de 1985.","De Reforma del Estatuto de Autonomía de Castilla y León, de 30 de noviembre de 2007.","De Procedimiento Administrativo Común de las Administraciones Públicas, de 1 de octubre de 2015.","Del Poder Judicial, de 1 de julio de 1985.","C"
"568","¿Qué tipo de ley es necesaria para regular el desarrollo del artículo 21 de la Constitución española?","Ley ordinaria.","Ley orgánica.","Ley marco.","Ley de bases.","B"
"569","Las Cortes Generales podrán delegar la potestad de dictar normas con rango de ley sobre materias determinadas que no deban ser desarrolladas por leyes orgánicas en:","El Gobierno.","Las comunidades autónomas.","Comisiones Informativas.","Comisiones delegadas del Gobierno.","A"
"570","Una delegación legislativa cuyo objeto sea la formación de textos articulados deberá otorgarse mediante:","Un decreto legislativo.","Una ley orgánica.","Una ley de bases.","Una ley ordinaria.","C"
"571","Una delegación legislativa cuyo objeto sea refundir varios textos legales en uno solo deberá otorgarse mediante:","Un decreto legislativo.","Una ley orgánica.","Una ley de bases.","Una ley ordinaria.","D"
"572","Señale la expresión correcta en relación a las delegaciones legislativas de las Cortes Generales:","Deberán otorgarse de forma expresa.","Deberán otorgarse para materia concreta.","Deberá fijarse un plazo para su ejercicio.","Todas las respuestas anteriores son correctas.","D"
"573","Señale la expresión incorrecta en relación a las delegaciones legislativas de las Cortes Generales:","La delegación legislativa se agota mediante la publicación de la norma correspondiente.","La primera prórroga de la delegación es concedida de modo automático.","La delegación no podrá entenderse concedida de modo implícito o por tiempo indeterminado.","La delegación no podrá permitir la subdelegación a autoridades distintas del propio órgano al que se le delega.","B"
"574","La delegación legislativa para refundir textos legales:","Determinará el ámbito normativo a que se refiere el contenido de la delegación.","Debe circunscribirse a la formulación de un texto único.","Debe circunscribirse a regularizar, aclarar y armonizar los textos legales que han de ser refundidos.","Todas las respuestas anteriores son correctas.","A"
"575","Las delegaciones legislativas podrán ser controladas a través de","Los tribunales.","Comisiones informativas.","Fórmulas adicionales de control establecidas en las leyes de delegación.","Las respuestas a y c son correctas.","D"
"576","La convalidación de un decreto legislativo es competencia de:","El Senado.","El Congreso de los Diputados.","El Gobierno de la nación.","Ninguna de las respuestas anteriores es correcta.","B"
"577","Si se dicta una ley de bases, ¿qué contenido tendrá el decreto legislativo de desarrollo?","Texto articulado.","Ley ordinaria.","Texto refundido.","Texto delegado.","A"
"578","¿El Gobierno podrá subdelegar la facultad de dictar legislación delegada?","En ningún caso.","No, salvo que se delegue en órganos administrativos.","Sí, siempre que lo autorice la ley de delegación.","Sí, siempre que se delegue en autoridades ministeriales.","A"
"579","Las leyes de bases mencionadas en el artículo 82 de la Constitución española contienen;","El Presupuesto para realizar la norma legislativa asignada.","La entrada en vigor de la delegación legislativa.","Los principios y criterios de la delegación legislativa.","Ninguna de las respuestas anteriores es correcta.","C"
"580","Señale la respuesta incorrecta. Las leyes de bases no podrán en ningún caso:","Autorizar la modificación de la propia ley de bases.","Facultar para dictar normas con carácter retroactivo.","Ser utilizadas para conceder delegaciones legislativas.","Autorizar a desarrollar textos jurídicos refundidos.","C"
"581","Cuando una proposición de ley o una enmienda fuere contraria a una delegación legislativa en vigor, ¿qué órgano está facultado para oponerse a su tramitación?","El Gobierno.","Las comunidades autónomas.","Comisiones Informativas.","Comisiones delegadas del Gobierno.","A"
"582","En el supuesto de que una proposición de ley o enmienda fuera contraria a una delegación legislativa en vigor, ¿qué puede presentarse para la derogación total o parcial de la ley de delegación?-","Una ley de bases.","Una proposición de ley.","Un proyecto de ley.","Las respuestas a y b son correctas.","B"
"583","Las disposiciones del Gobierno que contengan legislación delegada recibirán el título de:","Leyes legislativas.","Decretos leyes.","Decretos legislativos.","Decretos delegados.","C"
"584","En caso de extraordinaria y urgente necesidad, el Gobierno podrá dictar disposiciones legislativas provisionales en forma de:","Leyes provisionales.","Decretos leyes.","Decretos legislativos.","Decretos delegados.","B"
"585","Las disposiciones legislativas provisionales dictadas por el Gobierno en caso de extraordinaria y urgente necesidad no podrán afectar:","Al ordenamiento de las instituciones básicas del Estado.","A los derechos, deberes y libertades de los ciudadanos regulados en el Título I.","Al Derecho electoral general.","Todas las respuestas anteriores son correctas.","D"
"586","Las disposiciones legislativas provisionales dictados por el Gobierno en caso de extraordinaria y urgente necesidad no podrán afectar a materias que deban ser reguladas por:","Ley orgánica.","Ley ordinaria.","Decretos leyes.","Reales decretos legislativos.","A"
"587","Los decretos leyes deberán ser inmediatamente sometidos a debate y votación en el plazo de:","Diez días siguientes a su promulgación.","Quince días siguientes a su promulgación.","Veinte días siguientes a su promulgación.","Treinta días siguientes a su promulgación.","D"
"588","El Congreso de los Diputados habrá de pronunciarse expresamente sobre la convalidación o derogación de los decretos leyes. Para dicho trámite el reglamento establecerá:","Un procedimiento urgente.","Un procedimiento especial y sumario.","Un procedimiento deliberativo.","Un procedimiento mixto.","B"
"589","Durante el plazo establecido para ser sometidos a debate y votación de totalidad los decretos leyes pueden ser tramitados como:","Proyectos de ley por el procedimiento de urgencia.","Proyectos de ley.","Decretos leyes por el procedimiento de urgencia.","Decretos legislativos por el procedimiento de urgencia.","A"
"590","¿Qué materias entran dentro del ámbito jurídico de los decretos leyes?","La protección social, económica y jurídica de la familia.","El régimen de las comunidades autónomas.","El Derecho electoral general.","La libertad ideológica, religiosa y de culto.","A"
"591","¿Cuáles son las disposiciones del Gobierno que tienen fuerza de ley?","Las leyes orgánicas","Los decretos leyes.","Los decretos legislativos.","Las respuestas by c son correctas.","D"
"592","Señale la afirmación correcta. Los decretos leyes son:","Un supuesto de delegación legislativa.","Una posibilidad normativa constitucional extraordinaria otorgada al Gobierno.","Una posibilidad de hacer una reforma urgente en leyes orgánicas.","Ninguna de las respuestas anteriores es correcta.","B"
"593","¿Qué artículo de la Constitución española está dedicado a los decretos leyes?","Ochenta y tres.","Ochenta y cuatro.","Ochenta y cinco.","Ochenta y seis.","D"
"594","Señale la respuesta incorrecta. Según el artículo 87 de la Constitución española la iniciativa legislativa corresponde:","Al Gobierno.","Al Congreso y al Senado.","Los órganos ejecutivos de las comunidades autónomas.","Las asambleas de las comunidades autónomas.","C"
"595","Para la concreción de la iniciativa legislativa de las comunidades autónomas podrán:","Solicitar del Gobierno la adopción de un proyecto de ley.","Remitir a la Mesa del Congreso una proposición de ley.","Solicitar del Gobierno la adopción de una proposición de ley.","Las respuestas. a y b son correctas.","D"
"596","Las asambleas de las comunidades autónomas podrán remitir al Congreso una iniciativa legislativa delegando ante dicha Cámara un determinado número de miembros de la Asamblea encargados de su defensa:","Un máximo de dos miembros.","Un máximo de tres miembros.","Un máximo de cuatro miembros.","Un máximo de cinco miembros.","B"
"597","Las requisitos y formas de ejercicio de la iniciativa legislativa popular deberán ser reguladas mediante:","Ley ordinaria.","Ley orgánica.","Decreto legislativo.","Ley de bases.","B"
"598","La iniciativa legislativa popular se materializará mediante la presentación de:","Proposiciones de ley.","Proyectos de ley.","Proyectos legislativos.","Mociones.","A"
"599","Para poder llevar a cabo la iniciativa legislativa popular se exigirán no menos de:","Cien mil firmas acreditadas.","Doscientas cincuenta mil firmas acreditadas.","Quinientas mil firmas acreditadas.","Un millón de firmas acreditadas.","C"
"600","Señale la respuesta incorrecta, No procederá la iniciativa popular en materia legislativa en materias propias de:","Ley orgánica.","Leyes tributarias.","Leyes de carácter internacional.","Leyes penales.","D"
"601","La iniciativa legislativa del Congreso de los Diputados, del Senado y de las asambleas autonómicas se concretará en:","Proposiciones de ley.","Proyectos de ley.","Proyectos legislativos delegados.","Proposiciones legislativas delegadas.","A"
"602","Recibida una proposición de ley ante la Mesa del Congreso:","La Mesa del Congreso ordenará la publicación de la proposición de ley y su remisión al Gobierno para que manifieste su criterio respecto a la toma en consideración.","Se ordena su inmediata publicación en el Boletín Oficial de las Cortes Generales.","Se estudia o no la conveniencia de su publicación en el BОЕ.","Solo se ordena su publicación si el Gobierno la declara de urgente tramitación.","A"
"603","La iniciativa legislativa prevista en el artículo 87.3 se puede ejercer según lo dispuesto en la:","Ley Orgánica 9/1984, de 26 de marzo, reguladora de la iniciativa legislativa popular.","Ley Orgánica 3/1984, de 26 de marzo, reguladora de la iniciativa legislativa popular.","Ley Orgánica 9/1994, de 26 de marzo, reguladora de la iniciativa legislativa popular.","Ley Orgánica 3/1998, de 26 de marzo, reguladora de la iniciativa legislativa popular.","B"
"604","Sobre la admisibilidad de las proposiciones de ley presentadas por iniciativa popular se pronuncia:","El Presidente del Congreso.","La Mesa del Congreso.","El Registro de las Cortes Generales.","Las respuestas a y b son correctas.","B"
"605","En función del artículo 88 de la Constitución española los proyectos de ley serán aprobados por;","El Consejo de Ministros.","El Congreso de los Diputados.","El Senado.","La Mesa del Congreso.","A"
"606","Es competencia del Consejo de Ministros:","Declarar el estado de sitio.","Resolver los recursos contencioso-administrativos que se interpongan ante cualquier miembro del Gobierno.","Aprobar las proposiciones de ley.","Aprobar los proyectos de ley.","D"
"607","Los proyectos de ley deberán ir acompañados de:","Un informe económico financiero.","Una exposición de motivos.","Los antecedentes necesarios para pronunciarse sobre ellos.","Las respuestas by c son correctas.","D"
"608","La tramitación de los proyectos de ley se regulará por:","La Constitución española.","Los reglamentos de las Cámaras.","Los procedimientos administrativos.","El reglamento del Congreso de los Diputados.","B"
"609","¿En qué artículo de la Constitución española se refiere a la iniciativa legislativa y sus clases?","Artículo 84.","Artículo 85.","Artículo 86.","Artículo 87.","D"
