"id","pregunta","a","b","c","d","correcta"
"610","Cuando la iniciativa legislativa es de los Diputados o de un Grupo parlamentario antes de ser debatido su contenido concreto debe ser sometida a:","La previa toma en consideración del Congreso.","La previa autorización de la Mesa del Congreso.","La previa toma en consideración de la Junta de Portavoces del Congreso.","La previa autorización del Presidente del Congreso.","A"
"611","Las proposiciones de ley que, de acuerdo con el artículo 87, tome en consideración el Senado, se remitirán a:","El Congreso para su tramitación.","La Comisión Informativa correspondiente.","La Comisión Permanente legislativa correspondiente.","La Comisión Permanente no legislativa correspondiente.","A"
"612","El Presidente del Congreso de los Diputados dará inmediata cuenta al Presidente al Senado, para su deliberación, de los proyectos de ley aprobados en caso de:","Leyes ordinarias.","Leyes orgánicas.","Leyes ordinarias y orgánicas.","Decretos legislativos.","C"
"613","Cuando el Senado recibe un proyecto de ley del Congreso, ¿qué plazo tiene, a partir del día de la recepción del texto, para oponer su veto o introducir enmiendas al mismo?","Un mes.","Dos meses.","Tres meses.","Cuatro meses.","B"
"614","Cuando el Senado recibe un proyecto de ley del Congreso, ¿qué mayoría necesita para aprobar su veto?","Mayoría simple.","Mayoría ponderada.","Mayoría absoluta.","Mayoría cualificada.","C"
"615","En caso de veto del Senado a un proyecto de ley, este no podrá ser sometido al Rey para sanción sin que el Congreso lo ratifique por:","Mayoría simple, o mayoría absoluta una vez transcurridos dos meses desde la interposición del mismo.","Mayoría ponderada.","Mayoría absoluta, o mayoría simple una vez transcurridos dos meses desde la interposición del mismo.","Mayoría cualificada.","C"
"616","En caso de que el Senado proponga enmiendas a un proyecto de ley, este no podrá ser sometido al Rey para sanción sin que el Congreso:","Se pronuncie sobre las enmiendas.","Se pronuncie sobre las enmiendas, aceptándolas o no por mayoría simple.","Se pronuncie sobre las enmiendas, aceptándolas o no por mayoría absoluta.","Ninguna de las respuestas anteriores es correcta.","B"
"617","Los proyectos de ley pueden ser declarados urgente por:","El Gobierno.","El Congreso de los Diputados.","El Senado.","Las respuestas a y b son correctas.","D"
"618","En caso de que un proyecto de ley sea declarado urgente el plazo que dispone el Senado para vetar o enmendar el proyecto se reducirá a:","Diez días naturales.","Quince días naturales.","Veinte días naturales.","Treinta días naturales.","C"
"619","La oposición de veto o introducción de enmiendas por parte del Senado a un proyecto de ley deberá ser:","En un plazo de tres meses.","Mediante mensaje motivado.","Devuelto al Ministerio correspondiente.","Retenido, para su reforma posterior.","B"
"620","El Rey sancionará las leyes aprobadas por las Cortes Generales en un plazo de:","Treinta días.","Veinte días.","Quince días.","Diez días.","C"
"621","Una vez sancionadas por el Rey las leyes aprobadas por las Cortes Generales, ¿quién promulga y ordena su inmediata publicación?","El Rey.","El Presidente del Gobierno.","El Presidente del Congreso de los Diputados.","Ninguna de las respuestas anteriores es correcta.","A"
"622","Dentro de los trámites para dotar de eficacia a las leyes aprobadas por las Cortes Generales, el acto de sancionar una ley consiste en:","Es un acto por el que el Rey da vigencia a la ley.","Es un acto por el que se proclama la facultad de obligar que posee la ley debidamente sancionada.","Es un acto por el que el Rey autentifica la ley.","Es un acto por el que se da conocimiento de la ley a aquellos que quedan obligados a ella.","C"
"623","El acto de promulgar, dentro de los trámites para dotar de eficacia a las leyes aprobadas por las Cortes Generales, consiste en:","Es un acto por el que se proclama la facultad de obligar que posee la ley debidamente sancionada.","Es un acto por el que el Rey da vigencia a la ley.","Es un acto por el que el Rey autentifica la ley.","Es un acto por el que se da conocimiento de la ley a aquellos que quedan obligados a ella.","B"
"624","De acuerdo con el artículo 2 del Código Civil las leyes entran en vigor:","A los veinte días de su completa publicación en el BOE, a no ser que en ellas se disponga otra cosa.","A los quince días de su completa publicación en el BOE, a no ser que en ellas se disponga otra cosa.","A los diez días de su completa publicación en el BOE, a no ser que en ellas se disponga otra cosa.","A los treinta días de su completa publicación en el BOE, a no ser que en ellas se disponga otra cosa.","A"
"625","¿Puede publicarse una ley en el Boletín Oficial del Estado para que empiece a aplicarse en el plazo de un año?","No.","Sí, pero tiene que indicarse en el texto.","Solo si se trata de leyes ordinarias.","Solo si se trata de leyes orgánicas.","B"
"626","En función del artículo 92 de la Constitución española podrán ser sometidas a referéndum consultivo de todos los ciudadanos:","Las cuestiones internacionales.","Las decisiones políticas de especial trascendencia.","Las cuestiones territoriales.","Todas las respuestas anteriores son correctas.","B"
"627","En función del artículo 92 de la Constitución española los referéndum consultivos serán convocados por:","El Presidente del Gobierno.","El Rey.","El Rey, mediante propuesta del Presidente del Gobierno.","El Rey, mediante propuesta del Congreso de los Diputados.","C"
"628","¿Qué tipo de ley será necesaria para regular las condiciones y el procedimiento de las distintas modalidades de referéndum previstas en esta Constitución?","Ley ordinaria.","Ley orgánica.","Leyes ordinarias y orgánicas.","Decreto legislativo.","B"
"629","Las invocaciones a la figura del referéndum están recogidas en la Constitución española en sus:","Artículos 93 у 169.","Artículos 92 у 167.","Artículos 92, 167 y 168.","Artículos 116, 167 y 168.","C"
"630","En función del artículo 92 de la Constitución española los referéndum deberán ser autorizados por:","El Rey.","El Presidente del Gobierno.","El Congreso de los Diputados.","El Senado.","C"
"631","Los referéndum convocados al amparo del artículo 92 de la Constitución:","Tienen fuerza vinculante.","No tienen fuerza vinculante.","Son de cumplimiento obligatorio.","Su resultado es vinculante, pero ha de ser ratificado por las Cortes Generales.","B"
"632","La modalidad de referéndum previsto en el artículo 92 de la Constitución fue utilizado para:","Proponer la entrada en la Comunidad Europea.","Aprobar la reforma constitucional necesaria para el Tratado de Maastricht.","Proponer la permanencia de España en la OTAN, en 1986.","No ha sido utilizado ninguna vez.","C"
"633","Indica cuál de las siguientes respuestas no es una institución de democracia directa:","Las elecciones locales.","La iniciativa popular.","El concejo abierto.","El referéndum.","A"
"634","Se podrá autorizar la celebración de tratados por los que se atribuya a una organización o institución internacional el ejercicio de competencias derivadas de la Constitución española mediante:","Leyes ordinarias.","Leyes orgánicas.","Leyes ordinarias y orgánicas.","Decretos legislativos.","B"
"635","La garantía del cumplimiento de los tratados internacionales y de las resoluciones emanadas de los organismos internacionales 0 supranacionales titulares de la cesión corresponde:","A las Cortes Generales.","Al Congreso de los Diputados.","Al Gobierno o a las Cortes Generales.","Las respuestas a y c son correctas.","C"
"636","Señale la respuesta incorrecta. La prestación del consentimiento del Estado para obligarse por medio de tratados o convenios requerirá la previa autorización de las Cortes Generales, en los siguientes casos:","Tratados de carácter geopolítico.","Tratados de carácter político.","Tratados de carácter militar.","Convenios de carácter militar.","A"
"637","Señale la respuesta incorrecta. La prestación el consentimiento del Estado para obligarse por medio de tratados o convenios requerirá la previa autorización de las Cortes Generales, en los siguientes casos:","Tratados o convenios que afecten a la integridad territorial del Estado o a los derechos y deberes fundamentales establecidos en el Título I.","Tratados o convenios de carácter medioambiental.","Tratados o convenios que impliquen obligaciones financieras para la Hacienda Pública.","Tratados o convenios que supongan modificación o derogación de alguna ley o exijan medidas legislativas para su ejecución.","B"
"638","¿Quién debe ser informado de la conclusión de los tratados o convenios internacionales que no necesiten autorización de las Cortes Generales?","El Gobierno.","El Congreso de los Diputados.","El Senado.","El Congreso de los Diputados y el Senado.","D"
"639","Según el artículo 95 de la Constitución española la celebración de un tratado internacional que contenga estipulaciones contrarias a la Constitución:","Será anulable.","Será nulo de pleno derecho.","Exigirá la previa revisión constitucional.","No entrará en vigor.","C"
"640","Para conocer si un tratado internacional contiene estipulaciones contrarias a la Constitución pueden requerir al Tribunal Constitucional que declare si existe o no esa contradicción:","El Gobierno.","El Congreso de los Diputados.","El Senado.","Todas las respuestas anteriores son correctas.","D"
"641","La previa revisión constitucional estipulada en el artículo 95 de la Constitución española se hizo efectiva:","Antes de la ratificación de la entrada en la Organización del Tratado del Atlántico Norte.","Antes de la ratificación del Tratado de la Unión Europea.","Antes de la ratificación del Tratado de Maastricht.","Antes de la ratificación del Tratado de Schengen.","B"
"642","¿En base a qué artículo de la Constitución española todo el Derecho Comunitario entra a formar parte del ordenamiento jurídico interno español?","Artículo noventa.","Artículo noventa y uno.","Artículo noventa y dos.","Artículo noventa y seis.","D"
"643","Los tratados internacionales, válidamente celebrados, formarán parte del ordenamiento interno:","Una vez publicados oficialmente en España.","Una vez sancionados por el Rey.","Una vez aprobados por las Cortes Generales.","A los treinta días de su publicación oficial en España.","A"
"644","Las disposiciones de los tratados internacionales vigentes en España solo podrán ser derogadas, modificadas o suspendidas:","En la forma prevista en los propios tratados.","Mediante autorización del Gobierno o del Congreso de los Diputados y el Senado.","De acuerdo con las normas generales del Derecho internacional.","Las respuestas a y c son correctas.","D"
"645","En función del artículo 96 de la Constitución española para la denuncia de los tratados y convenios internacionales se utilizará el procedimiento previsto para su aprobación en;","El artículo 92.","El artículo 93.","El artículo 94.","El artículo 97.","C"
