"id","pregunta","a","b","c","d","correcta"
"88","Los derechos fundamentales y libertades públicas que se contemplan en la Sección Primera del Capitulo Segundo del Título I de la constitución pueden regularse:","Solo por ley orgánica.","Por ley orgánica o por ley ordinaria, pero nunca por Decreto-ley o Decreto legislativo.","Por ley orgánica, por ley ordinaria o por Decreto-ley, pero nunca por Decreto legislativo.","Por ley orgánica, ley ordinaria, Decreto-ley o Decreto legislativo.","A"
"89","La Constitución recoge el derecho y el deber de trabajar de todos los españoles, y con relación al mismo señala que todos los españoles tienen derecho a:","La libre elección de un puesto de trabajo","La promoción a través del trabajo","Una remuneración adecuada a su situación socio familiar","La especialización y formación en su puesto de trabajo","B"
"90","El derecho al trabajo se plasma en la Constitución:","En el art. 35.","En la sección Primera del Capítulo Segundo del Título I.","En el art. 40.","En el Capítulo Tercero del Título I.","A"
"91","El derecho a la negociación colectiva laboral entre los representantes de los trabajadores y empresarios al que se refiere el artículo 37 de la Constitución Española, vendrá garantizado por:","Los convenios laborales, con posibilidad de ser facultativos.","La Ley","La costumbre","Los convenios, sin posibilidad de ser vinculantes (Examen Subalternos Galicia 2021)","B"
"92","Según el artículo 38 de la Constitución Española de 1978, se reconoce la libertad de empresa en el marco de la:","Economía de mercado.","Economía colegiada.","Negociación colectiva.","Libre elección de profesión u oficio.","A"
"93","La Constitución Española recoge el derecho de fundación:","Para fines de carácter social","Para fines de interés general, con arreglo a la ley","Para fines económicos, de acuerdo con las leyes","Para fines individuales particulares","B"
"94","En relación con la garantía de las libertades y de los derechos fundamentales, señale la respuesta correcta según los artículos 53 y 54 de la Constitución Española:","La institución del Defensor del Pueblo será regulada por ley ordinaria.","El Defensor del Pueblo supervisará la actividad de la Administración y dará cuenta al Gobierno.","El recurso de amparo ante el Tribunal Constitucional no será aplicable a la objeción de conciencia.","Sólo podrá regularse por ley el ejercicio de los derechos regulados en el Capítulo II (Derechos y Libertades) del Título Primero de la C.E.","D"
"95","Según lo dispuesto en el artículo 54 de la Constitución Española de 1978, la institución del Defensor del Pueblo se regulará por:","Real Decreto.","Ley Orgánica.","Real Decreto-Ley.","Real Decreto Legislativo.","B"
"96","En el artículo 54 de la Constitución vemos que el Defensor del Pueblo da cuenta de la supervisión de las actividades de la Administración a:","al Tribunal Constitucional","Al Gobierno","A las Cortes Generales","Al Poder Judicial","C"
"97","De acuerdo con el artículo 54: El Defensor del Pueblo:","Es designado por las Cortes Generales, a las que dará cuenta","Es designado por el Congreso de los Diputados, a los que dará cuenta","Es designado por el Rey, dando cuenta de su actividad a las Cortes Generales","Es designado por el pueblo, a votación, y dará cuenta a las Cortes Generales.","A"
"98","El domicilio es inviolable:","ninguna entrada o registro podrá hacerse en él salvo en caso de flagrante delito","ninguna entrada o registro podrá hacerse en él sin consentimiento del titular, salvo en caso de flagrante delito","ninguna entrada o registro podrá hacerse en él sin resolución judicial, salvo en caso de flagrante delito","ninguna entrada o registro podrá hacerse en él sin consentimiento del titular o resolución judicial, salvo en caso de flagrante delito","D"
"99","Tienen como misión garantizar la soberanía e independencia de España, defender su integridad territorial y el ordenamiento constitucional:","el Gobierno","el Jefe de Estado","los tribunales","las Fuerzas Armadas","D"
"100","La forma política del Estado español es:","la Monarquía parlamentaria","la soberanía nacional","el pluralismo político","la sociedad democrática","A"
