"id","pregunta","a","b","c","d","correcta"
"72","Las Administraciones Públicas solo requerirán a los interesados el uso obligatorio de firma para:","Fórmulas solicitudes.","interponer recursos.","Presentar declaraciones responsables.","Todas las respuestas anteriores son correctas.","D"
"73","Según el artículo 11 de la Ley 39/2015, de 1 de octubre, del Procedimiento Administrativo Común, con carácter general, para realizar cualquier actuación prevista en el procedimiento administrativo, será suficiente con que:","Los interesados expongan su condición de implicados en el procedimiento.","Los interesados acrediten su condición de titulares de derechos en el procedimiento","Los interesados acrediten previamente su identidad a través de cualquiera de los medios de identificación previstos en esta ley.","Los interesados declaren previamente su condición de interesados.","C"
"74","Las Administraciones Públicas solo requerirán a los interesados el uso obligatorio de firma para:","Desistir de acciones.","Renunciar a derechos.","Las respuestas a y b son correctas.","Presentar alegaciones.","C"
"75","Con carácter general, será suficiente con que los interesados acrediten previamente su identidad a través de cualquiera de los medios de identificación previstos en la Ley 39/2015, de 1 de octubre, del Procedimiento Administrativo Común de las Administraciones Públicas para:","Formular solicitudes.","Realizar cualquier actuación prevista en el procedimiento administrativo.","Desistir de acciones.","Interponer recursos.","B"
"76","¿En qué artículo de la Ley 39/2015, de 1 de octubre, del Procedimiento Administrativo común de las Administraciones Públicas se detallan los actos en que es obligatorio el uso de firma?","Artículo 10.","Artículo 11.","Artículo 14.","Artículo 20.","B"
"77","Según el artículo 12 de la Ley 39/2015, de 1 de octubre, del Procedimiento Administrativo Común, las Administraciones Públicas deberán garantizar que:","Los interesados autorizados puedan relacionarse con la Administración a través de medios electrónicos.","Los interesados puedan relacionarse con la Administración a través de medios electrónicos.","Los medios electrónicos sean utilizados correctamente por todos los usuarios.","Ninguna de las respuestas anteriores es correcta.","B"
"78","Señale la respuesta incorrecta. Conforme al artículo 12.2. de la Ley 39/2015, de 1 de octubre, del Procedimiento Administrativo Común, las Administraciones Públicas, a los interesados que no estén obligados a relacionarse electrónicamente con ellas, les asistirán especialmente en lo referente a:","Presentación de solicitudes a través del registro electrónico general.","Obtención de certificados electrónicos y firmas digitales.","Obtención de copias auténticas.","Identificación y firma electrónica.","B"
"79","Cuando un funcionario público realice una firma electrónica por un interesado que no dispone de los medios electrónicos necesarios, será necesario que:","Dicho interesado preste su consentimiento expreso para esta actuación.","Dicho interesado se identifique ante el funcionario.","Quede constancia para los casos de discrepancia o litigio.","Todas las respuestas anteriores son correctas.","D"
"80","Las Administraciones Públicas mantendrán actualizado un registro, u otro sistema equivalente, donde constarán los funcionarios habilitados para la identificación a firma electrónica:","Donde, al menos, constarán las oficinas de registro electrónico.","Donde, al menos, constarán las firmas hechas electrónicamente.","Donde, al menos, constarán los funcionarios que presten servicios en las oficinas de asistencia en materia de registros.","Ninguna de las respuestas anteriores es correcta.","C"
"81","La Administración General del Estado, las comunidades autónomas y las entidades locales mantendrán actualizado un registro, u otro sistema equivalente, donde constarán los funcionarios habilitados para la identificación o firma regulada en el artículo 12 de la Ley 39/2015 de 1 de octubre, del Procedimiento Administrativo Común de las Administraciones Públicas. Estos registros o sistemas deberán:","Estar plenamente interoperables.","Estar plenamente interconectados.","Ser plenamente interoperables y estar interconectados con los de las restantes Administraciones Públicas, a los efectos de Comprobar la validez de las citadas habilitaciones.","Las respuestas a y b son correctas.","C"
"82","Las oficinas en materia de registros tienen, al menos, las siguientes funciones:","Digitalización, copias auténticas y registro (Artículos 12,16 y 17).","Practicar comunicaciones o notificaciones personales (Artículo 41.1.a).","Ayudar en la iniciación de un procedimiento, y facilitar código de identificación del órgano, centro o unidad administrativa (Artículo 66).","Todas las respuestas anteriores son correctas.","D"
