"id","pregunta","a","b","c","d","correcta"
"305","Las Administraciones Púbicas, en caso de que no haya sido posible notificar al interesado, podrán Publicar un anuncio en el Boletín de la Comunidad Autónoma o de la Provincia:","Si, con carácter preceptivo después de que dicho anuncio haya sido Publicado en el BOE.","En ningún caso, la Publicación de los anuncios, para que estos sean considerados válidos en Derecho, deberá ser exclusivamente a través del BOЕ.","Si, previamente y con carácter facultativo, a la Publicación en el BOE.","Solo podrá ser anunciado, aparte de en el BOE, en el tablón de edictos del Consulado o Sección Consular de la embajada correspondiente, en caso de que el último domicilio conocido fuera en el extranjero.","C"
"306","Además de la preceptiva Publicación en el BOE de las notificaciones que hayan resultado infructuosas podrán Publicarse anuncios facultativos en:","El tablón de edictos del ayuntamiento del ultimo domicilio del interesado.","El tablón de edictos del consulado o sección consular de la embajada correspondiente.","Otras formas de notificación complementarias a través de los medios de difusión.","Todas las respuestas anteriores son correctas.","D"
"307","¿De los siguientes casos qué actos administrativos serán objeto de Publicación, surtiendo está Publicación los efectos de la notificación?","Cuando el acto tenga por destinatario a una pluralidad determinada de personas.","Cuando el acto tenga por destinatario a una pluralidad indeterminada de personas.","Cuando la Administración estime que la notificación efectuada a un solo interesado es insuficiente para garantizar la notificación a todos los interesados.","Las respuestas by c son correctas.","D"
"308","¿En qué casos de los siguientes los actos administrativos serán objeto de Publicación, surtiendo está Publicación los efectos de la notificación?","Cuando se trate de actos integrantes de un procedimiento selectivo.","Cuando se trate de actos integrantes de concurrencia competitiva.","Cuando se trate de un procedimiento sancionador.","Las respuestas a y b son correctas.","D"
"309","La Publicación de un acto administrativo deberá contener:","Los mismos elementos que el artículo 50.2 de la Ley 39/2015, de 1 de octubre, del Procedimiento Administrativo Común de las Administraciones Públicas.","Los mismos elementos que el artículo 40.2 de la Ley 39/2015, de 1 de octubre, del Procedimiento Administrativo Común de las Administraciones Públicas.","Los mismos elementos que sean estipulados por el sistema de notificación.","Ninguna de las respuestas anteriores es correcta.","B"
"310","En los supuestos de Publicaciones de actos que contengan elementos comunes:","Deberán Publicarse de forma conjunta los aspectos coincidentes.","Podrán Publicarse de forma conjunta los aspectos coincidentes.","Podrán Publicarse de forma conjunta los aspectos coincidentes, especificándose solamente los aspectos individuales de cada acto.","Podrán Publicarse de forma conjunta los individuales, especificándose solamente los aspectos coincidentes de cada acto.","C"
"311","Cuando, por disposición legal o reglamentaria deba practicarse la Publicación de actos y comunicaciones en tablón de anuncios o edictos:","Este trámite será ineludible.","Debe practicarse en el tablón de anuncios y edictos y, complementariamente, en el Diario oficial correspondiente.","Se entenderá cumplida por su Publicación en el Diario oficial correspondiente.","Ninguna de las respuestas anteriores es correcta.","C"
"312","En las convocatorias de determinados procedimientos deberán indicar el medio donde se efectuarán las sucesivas Publicaciones de sus actos, careciendo de validez las que se lleven a cabo en lugares distintos. Estos procedimientos son:","Procedimientos de concurrencia competitiva y procedimientos selectivos.","Procedimientos de convocatorias de subvenciones nominativas.","Las respuestas a y b son correctas.","Ninguna de las respuestas anteriores es correcta.","A"
"313","Las especificaciones que afectan a la Publicación de actos administrativos están contenidas en la Ley 39/2015, de 1 de octubre, del Procedimiento Administrativo Común de las Administraciones Públicas en su artículo:","Treinta y cinco.","Cuarenta.","Cuarenta y cinco.","Cincuenta.","C"
"314","En caso de que el órgano competente apreciase que la notificación por medio de anuncios o Publicación pudiera lesionar derechos o intereses legítimos, se limitara a Publicar una somera indicación del contenido y lugar donde podrán comparecer los interesados:","En el Boletín Oficial del Estado.","En el Boletín de la Comunidad Autónoma o Provincia correspondiente.","En el Diario oficial correspondiente.","En el Boletín Oficial de la Provincia y en el tablón de edictos del ayuntamiento.","C"
"315","Cuando un órgano se limite a Publicar en el diario oficial que corresponda una somera indicación del contenido de un acto, el lugar donde los interesados podrán comparecer y en el plazo que se establezca, se pretende conseguir:","El conocimiento por los interesados del contenido íntegro del mencionado acto, sin lesionar sus derechos ni intereses legítimos.","Tener constancia del conocimiento por los interesados del contenido íntegro de dicho acto.","Proteger derechos o intereses legítimos de los interesados.","Todas las respuestas anteriores son correctas.","D"
"316","Señale la respuesta incorrecta. Los actos de las Administraciones Públicas son nulos de pleno derecho en los casos siguientes:","Los que lesionen los derechos y libertades susceptibles de amparo constitucional.","Los dictados por órgano manifiestamente incompetente por razón de la materia y jerarquía.","Los que tengan un contenido imposible.","Los que sean constitutivos de infracción penal o se dicten como consecuencia de esta.","B"
"317","Señale la respuesta incorrecta. Los actos de las Administraciones Públicas son nulos de pleno derecho en los casos siguientes:","Los dictados prescindiendo total y absolutamente del procedimiento legalmente establecido o de las normas que contienen las reglas esenciales para la formación de la voluntad de los órganos colegiados.","Los actos presuntos o expresos contrarios al ordenamiento jurídico por lo qué se adquieren facultades o derechos cuando se carezca de los requisitos esenciales para su adquisición.","Cualquier otro establecido expresamente en una disposición con rango de ley.","Los actos que incurran en cualquier infracción del ordenamiento jurídico, incluso la desviación de poder.","D"
"318","Señale la respuesta incorrecta. Las disposiciones administrativas de las Administraciones Públicas son nulas de pleno derecho en los casos siguientes:","Las disposiciones administrativas que vulneren la Constitución, las leyes u otras disposiciones administrativas de rango superior.","Las disposiciones administrativas que regulen materias reservadas a la ley.","Las disposiciones administrativas que establezcan la retroactividad de disposiciones no favorables o restrictivas de derechos individuales.","Los actos que incurran en defecto de forma del ordenamiento jurídico.","D"
"319","¿Qué artículo de la Ley 39/2015, de 1 de octubre, del Procedimiento Administrativo Común de las Administraciones Públicas, se dedica a los casos de nulidad de pleno derecho de los actos administrativos?","Artículo 43.","Artículo 45.","Artículo 47.","Artículo 57.","C"
"320","Según el artículo 47 de la Ley 39/2015, de 1 de octubre, del Procedimiento Administrativo Común de las Administraciones Públicas no son nulas de pleno derecho los actos de las Administraciones Públicas en los siguientes casos:","Cuando sean constitutivos de infracción penal o se dicten como consecuencia de esta.","Cuando sean constitutivos de infracción administrativa o se dicten como consecuencia de esta.","Cuando sean contrarios al ordenamiento jurídico por los que se adquieren facultades o derechos cuando se carezca de los requisitos esenciales para su adquisición.","Los dictados prescindiendo total y absolutamente del procedimiento administrativo.","B"
"321","La resolución por parte de un Delegado Territorial de la Consejería de Medio Ambiente de una comunidad autónoma en una materia competente del Delegado Territorial de la Consejería de Vivienda y Urbanismo de otra provincia de esa misma comunidad autónoma, da lugar a una incompetencia:","Formal y territorial.","Territorial.","Material y territorial.","Material y jerárquica.","C"
"322","La resolución por parte de un Delegado Territorial de la Consejería de Medio Ambiente de una comunidad autónoma en una materia competente del Delegado Territorial de la Consejería de Vivienda y Urbanismo de otra provincia de esa misma comunidad autónoma, da lugar a una:","Nulidad relativa.","Nulidad absoluta.","Anulabilidad.","Necesidad de convalidación.","B"
"323","Señale la respuesta incorrecta. Los actos de las Administraciones Públicas son anulables en los casos siguientes:","Cuando incurran en cualquier infracción del ordenamiento jurídica, incluso la desviación de poder.","El defecto de forma solo determinará la anulabilidad cuando el acto carezca de los requisitos formales indispensables para alcanzar su fin o de lugar a la indefensión de los interesados.","La realización de actuaciones administrativas fuera del tiempo establecido para ellas solo implicara la anulabilidad del acto cuando así lo imponga la naturaleza del término o plazo.","Todas las respuestas anteriores son incorrectas.","D"
"324","Un defecto de forma en un acto administrativo determinará la anulabilidad de dicho acto:","Cuando no sea subsanable.","Cuando dé lugar a la indefensión de los interesados.","Cuando el acto carezca de los requisitos formales indispensables para alcanzar su fin.","Las respuestas by c son correctas.","D"
"325","Una actuación administrativa fuera del tiempo establecido:","Implica la nulidad del acto.","Implicará la anulabilidad del acto cuando así lo imponga la naturaleza del término o plazo.","No implica nulidad ni anulabilidad.","Ninguna de las respuestas anteriores es correcta.","B"
"326","Señale la respuesta correcta en relación con los límites a la extensión de la nulidad o anulabilidad de los actos:","La nulidad o anulabilidad de un acto no implicara la de los sucesivos en el procedimiento que sean independientes del primero.","La nulidad o anulabilidad en parte del acto administrativo no implicará la de las partes del mismo independientes de aquella, salvo que la parte viciada sea de tal importancia que sin ella el acto administrativo no hubiera sido dictado.","Las respuestas a y b son correctas.","Las respuestas a y b son incorrectas.","C"
"327","Según el artículo 50 de la Ley 39/2015, de 1 de octubre, del Procedimiento Administrativo Común, y en relación a la conversión de actos viciados:","La conversión de actos viciados solo es posible con actos nulos.","Los actos nulos o anulables que, sin embargo, contengan los elementos constitutivos de otro distinto producirán los efectos de este.","La conversión de actos viciados solo es posible con actos anulables.","Ninguna de las respuestas anteriores es correcta.","B"
"328","Según el artículo 51 de la Ley 39/2015, de 1 de octubre, del Procedimiento Administrativo Común, y en relación a la conservación de actos y trámites:","La conservación de actos viciados solo es posible con actos nulos.","La conservación de actos viciados solo es posible con actos anulables.","El órgano que declare la nulidad o anule las actuaciones dispondrá siempre la conservación de aquellos actos y trámites cuyo contenido se hubiera mantenido igual de no haberse cometido la infracción.","Ninguna de las respuestas anteriores es correcta.","C"
"329","Conforme al artículo 51 de la Ley 39/2015, de 1 de octubre, del Procedimiento Administrativo Común de las Administraciones Públicas la conservación de actos y trámites de actos nulos será acordada por:","El órgano autor del acto nulo.","La jurisdicción contencioso-administrativa.","El órgano que acordó la nulidad o anulo las actuaciones.","El superior jerárquico del autor del acto nulo.","C"
"330","Señale la respuesta incorrecta, en relación con la convalidación:","La Administración podrá convalidar los actos anulables, subsanando los vicios de que adolezcan.","El acto de convalidación producirá efecto desde su fecha, salvo Ío dispuesto en el artículo 39.3 de la Ley 39/2015, de 1 de octubre, del Procedimiento Administrativo Común de las Administraciones Públicas para la retroactividad de los actos administrativos.","Si el vicio consistiera en incompetencia jerárquica, la convalidación podrá realizarse por el órgano competente cuando sea superior jerárquico del que dictó el acto viciado.","Si el vicio consistiera en incompetencia por razón de la materia, la convalidación podrá realizarse por el órgano competente cuando sea superior jerárquico del que dictó el acto viciado.","D"
