"id","pregunta","a","b","c","d","correcta"
"257","El contenido de los actos administrativos se ajustará a lo dispuesto:","En la Ley 39/2015, de 1 de octubre, del Procedimiento Administrativo Común de las Administraciones Públicas y por el ordenamiento jurídico.","Por el ordenamiento jurídico y será determinado y adecuado a los fines de aquellos.","En la Constitución y por el ordenamiento jurídica.","En la Constitución, por el ordenamiento jurídico y lo que dicten sus normas de desarrollo.","B"
"258","De acuerdo con el artículo 35 de la Ley 39/2015, de 1 de octubre, del Procedimiento Administrativo Común, serán motivados, con sucinta referencia de hechos y fundamentos de derecho:","Los actos que se separen del criterio seguido en actuaciones precedentes o del dictamen de órganos consultivos.","Los acuerdos de suspensión de actos, cualquiera que sea el motivo de esta, así como la adopción de medidas provisionales.","Los acuerdos de aplicación de la tramitación de urgencia, de ampliación de plazos y de realización de actuaciones complementarias.","Todas las respuestas anteriores son correctas.","D"
"259","Señale la respuesta incorrecta. En función del artículo 35 de la Ley 39/2015, de 1 de octubre, del Procedimiento Administrativo común, serán motivados, con sucinta referencia de hechos y fundamentos de derecho:","Los actos que acepten pruebas propuestas por los interesados.","Los actos que acuerden la terminación del procedimiento por la imposibilidad material de continuarlo por causas sobrevenidas, así como los que acuerden el desistimiento por la Administración en procedimientos iniciados de oficio.","Las propuestas de resolución en los procedimientos de carácter sancionador, así como los actos que resuelvan procedimientos de carácter sancionador o de responsabilidad patrimonial.","Los actos que se dicten en el ejercicio de potestades discrecionales, así como los que deban serlo en virtud de disposición legal a reglamentaria expresa.","A"
"260","¿Qué tipos de actos se motivarán de conformidad con lo que dispongan las normas que regulen sus convocatorias?","Los actos que pongan fin a los procedimientos selectivos.","Los actos de concurrencia competitiva.","Las respuestas a y b son correctas.","Las respuestas a y b son incorrectas.","C"
"261","Serán motivados, con sucinta referencia de hechos y fundamentos de derechos:","Los actos que no limiten derechos subjetivos o intereses legítimos.","Los actos que resuelvan procedimientos de revisión de oficio de disposiciones o actos administrativos, recursos administrativos y procedimientos de arbitraje y los que declaren su inadmisión.","Las respuestas a y b son correctas.","Las respuestas a y b son incorrectas.","B"
"262","A su juicio, ¿qué diferencias hay entre las potestades discrecionales y potestades regladas de la Administración?","Las potestades regladas son aquellas en las que la actividad de la Administración se encuentra precisa y taxativamente establecida en la ley.","Las potestades discrecionales implican Una facultad de opción de la Administración entre dos o más soluciones igualmente válidas según la ley.","Las potestades discrecionales son aquellas potestades de la Administración que no pueden ser revisables ante la jurisdicción contencioso-administrativa ya que se ejecutan en el ejercicio de soberanía.","Las respuestas a y b son correctas.","D"
"263","Según la Ley 39/2015, de 1 de octubre, del Procedimiento Administrativo Común de las Administraciones Públicas deban ser motivados con sucinta referencia de hechos y fundamentos de derecho:","Las propuestas de resolución en los procedimientos de carácter sancionador.","Los actos que resuelvan procedimientos de carácter sancionador.","Los actos que resuelvan procedimientos de responsabilidad patrimonial.","Todas las respuestas anteriores son correctas.","D"
"264","Complete la siguiente frase con una de las cuatro opciones de respuesta. La relación de actos que deben ser preceptivamente motivados está expuesta en el artículo de la Ley 39/2015, de 1 de octubre, del Procedimiento Administrativo Común de las Administraciones Públicas.","Treinta.","Treinta y cinco.","Cincuenta y tres.","Treinta y seis.","B"
"265","Según el artículo 36 de la Ley 39/2015, de 1 de octubre, del Procedimiento Administrativo Común de las Administraciones Públicas, los actos administrativos, a menos que su naturaleza exija otra forma más adecuada de expresión y constancia, se producirán:","Por escrito a través de medios telemáticos.","Par medios telemáticos.","Por medios electrónicos.","Por escrito a través de medios electrónicos.","D"
"266","Señale la respuesta incorrecta. Cuando deba dictarse una serie de actos administrativos de la misma naturaleza, tales como nombramientos, concesiones o licencias:","Podrán refundirse en un único acto.","Se especificarán las personas u otras circunstancias que individualicen los efectos del acto para cada interesado.","La refundición en un solo acto será acordada por el órgano competente.","Deberán refundirse en un único acto.","D"
"267","En los casos en que los órganos ejerzan su competencia de forma verbal, la constancia escrita del acto, cuando sea necesaria:","Se efectuará y firmará por el funcionario que la reciba oralmente expresando en la comunicación del mismo la autoridad de la que procede.","Se efectuará y firmará por el titular del órgano inferior o funcionario que la reciba oralmente, expresando en la comunicación del mismo la autoridad de la que procede.","Se efectuará y firmará por et superior jerárquico del funcionario que la reciba oralmente, expresando en la comunicación del mismo la autoridad de la que procede.","Deberá refundirse en un único acto, acordado por el órgano competente.","B"
"268","En el caso que un órgano administrativo dictase resoluciones de forma verbal se deberá autorizar una relación de las mismas con expresión de su contenido por parte de:","El órgano superior titular de la competencia.","El titular de la competencia.","El órgano inferior titular de la competencia.","Ninguna de las respuestas anteriores es correcta.","B"
"269","Las resoluciones administrativas que vulneren lo establecido en una disposición reglamentaria, así como aquellas que incurran en alguna de las causas recogidas en el artículo 47 de la Ley 39/2015, de 1 de octubre, del Procedimiento Administrativo Común:","Son nulas.","Son anulables.","Son ilegales.","Son impugnables.","A"
"270","En relación a las disposiciones de carácter general (reglamentos), las resoluciones administrativas de carácter particular:","No podrán vulnerar lo establecido en una disposición de carácter general, aunque aquellas procedan de un órgano de igual o superior jerarquía al que dictó la disposición general.","No podrán vulnerar lo establecido en una disposición de carácter general, salvo que procedan de un órgano de igual o superior jerarquía.","Que vulneren Ío establecido en una disposición de carácter general serán anulables.","Las respuestas a y c son correctas.","A"
"271","La inderogabilidad singular de los actos administrativos en la Ley 39/2015, de 1 de octubre, del Procedimiento Administrativo Común de las Administraciones Públicas, se encuentre regulada en el:","Artículo 97.","Artículo 38.","Artículo 98.","Artículo 37.","D"
"272","La eficacia de los actos de las Administraciones Públicas quedará demorada cuando:","Así lo exija el contenido del acto.","Esté supeditada a su notificación.","Esté supeditada a su Publicación o aprobación superior.","Las respuestas anteriores son correctas.","D"
"273","Los actos de las Administraciones Públicas, se presumirán válidos y producirán efectos:","Desde la fecha que se indique expresamente en cada acto.","Desde la fecha en que se dicten, salvo que en ellos se disponga otra cosa.","Siempre desde la fecha en que se dicten.","Desde el siguiente a aquel en que se dicten, salvo que en ellos se disponga otra cosa.","B"
"274","En virtud del artículo 39 de la Ley 39/2015 de 1 de octubre, del Procedimiento Administrativo Común, podrá otorgarse eficacia retroactiva a los actos:","Nunca.","Excepcionalmente, cuando se dicte en sustitución de actos anulables.","Cuando se produzca el supuesto de convalidación de actos administrativos.","Excepcionalmente, cuando se dicten en sustitución de actos anulados y cuando produzcan efectos favorables para el interesado, siempre que los supuestos de hecho necesarios ya existieran en la fecha a que se retrotraiga la eficacia del acto y está no lesione derechos o intereses legítimos de otras personas.","D"
"275","Cuando una Administración Pública tenga que dictar, en el ámbito de sus competencias, un acto que necesariamente tenga por base otro dictado por una Administración Pública distinta y aquella entienda que es ilegal:","Podrá requerir a está previamente para que anule a revise el acto o acuerdo Con Ío dispuesto en la jurisdicción contencioso-administrativa.","Si el requerimiento previo no es atendido, podrá interponer recurso contencioso- administrativo.","Las respuestas a y b son correctas.","Las respuestas a y b son incorrectas.","C"
"276","Cuando una Administración Pública tenga que dictar un acto que necesariamente tenga por base otro dictado por una Administración Pública distinta, y aquella entienda que es ilegal, una vez puestas en marcha las opciones legales oportunas, el procedimiento para dictar resolución:","Seguirá adelante.","Quedara suspendido.","Quedara anulado.","Se retrotraerá al principio.","B"
"277","Señale la respuesta incorrecta. Toda notificación deberá contener según el artículo 40 de la Ley 39/2015 de 1 de octubre, del Procedimiento Administrativo Común:","El texto íntegro de la resolución.","La indicación si pone fin a la vía administrativa.","Los antecedentes de la resolución.","La expression de los recursos que procedan.","C"
"278","Las notificaciones que, conteniendo el texto Integro del acto, omitiesen alguno de los demás requisitos previstos en el artículo 40.2 surtirán efecto:","A partir de la fecha en que el interesado realice actuaciones que supongan el conocimiento del contenido y alcance de la resolución o acto objeto de la notificación, o interponga cualquier recurso que proceda.","A partir del día siguiente en que el interesado realice actuaciones que supongan el conocimiento del contenido y alcance de la resolución o acto objeto de la notificación, o interponga cualquier recurso que proceda.","A partir del día siguiente en que el interesado interponga cualquier recurso que proceda.","Ninguna de las respuestas anteriores es correcta.","A"
"279","¿En qué plazo deberá ser cursada una notificación que traslade una resolución, conforme a lo establecido en la Ley 39/2015, de 1 de octubre, del Procedimiento Administrativo Común de las Administraciones Públicas","Dentro del plazo de diez días a partir de la fecha en que el acto haya sido dictado.","Al día siguiente de ser dictado el acto.","Dentro del plazo de quince días a partir de la fecha en que el acto haya sido dictado.","Dentro del plazo de diez días a partir del día siguiente en que el acto haya sido dictado.","A"
"280","¿Qué deberá contener una notificación para que se entienda cumplida la obligación de notificar dentro del plazo máximo establecido para ello?","El texto íntegro y expresión de los recursos que procedan.","El texto íntegro.","El intento de notificación debidamente acreditado.","Las respuestas by c son correctas.","D"
"281","En la notificación de una resolución uno de los requisitos preceptivos es que debe expresar los recursos que, en su caso, procedan en:","Vía administrativa.","Vía judicial.","Vía extraoficial.","Las respuestas a y b son correctas.","D"
"282","Los preceptos que afectan a las notificaciones de resoluciones y actos están contenidos en la Ley 39/2015, de 1 de octubre, del Procedimiento Administrativo Común de las Administraciones Públicas en su artículo:","Treinta y cinco.","Cuarenta.","Cuarenta y cinco.","Cincuenta.","B"
"283","¿Cuál de las siguientes afirmaciones no es correcta en relación a las condiciones generales para la práctica de las notificaciones según la Ley 39/2015, de 1 de octubre, del Procedimiento Administrativo Común?","Las notificaciones se practicarán preferentemente por medios electrónicos y, en todo caso, cuando el interesado resulte obligado a recibirlas por esta vía.","Las notificaciones se practicarán indistintamente por medios escritos a electrónicos.","Se podrán practicar notificaciones por medios no electrónicos cuando para asegurar la eficacia de la actuación administrativa resulte necesario practicar la notificación por entrega directa de un empleado público de la Administración notificante.","Se podrán practicar notificaciones por medios no electrónicos cuando la notificación se realice con ocasión de la comparecencia espontanea del interesado o su representante en las oficinas de asistencia en materia de registro y solicite la comunicación o notificación personal en ese momento.","B"
"284","¿Quién podrá comunicar en cualquier momento a la Administración Pública, mediante los modelos normalizados que se establezcan al efecto, que las notificaciones sucesivas se practiquen o dejen de practicarse por medios electrónicos?","Los interesados que no estén obligados a recibir notificaciones electrónicas.","Todos los interesados.","Los interesados que estén obligados a recibir notificaciones electrónicas.","Todas las personas físicas.","A"
"285","Según el artículo 41 de la Ley 39/2015, de 1 de octubre, del Procedimiento Administrativo Común de las Administraciones Públicas, las notificaciones serán válidas:","Siempre que permita tener constancia del envío y recepción de las mismas.","Siempre que permita tener constancia de su envió o puesta a disposición, de la recepción o acceso por el interesado o su representante, de sus fechas y horas, del contenido integro y de la identidad fidedigna del remitente y destinatario de la misma.","Siempre que contengan los recursos que procedan y órgano ante el que hubieran de presentarse y plazos para interponerlos.","Las respuestas by c son correctas.","B"
"286","Si una notificación es realizada por distintos cauces, en papel y por medios electrónicos, se tomará como fecha de notificación:","La que el interesado hubiera comunicado mediante la formalización del modelo normalizado correspondiente.","Prevalecerá siempre la notificación hecha a través de medios electrónicos.","Aquella que se produzca en primer lugar.","En procedimientos iniciados a solicitud del interesado, la que se realice por el medio señalado al efecto por aquel. En procedimientos iniciados de oficio por la Administración, la realizada a través de medios electrónicos.","C"
"287","Conforme al artículo 41 de la Ley 39/2015, de 1 de octubre, del Procedimiento Administrativo Común, en ningún caso se efectuarán por medios electrónicos las siguientes notificaciones:","Aquellas en las que el acto a notificar vaya acompañado de elementos que no sean susceptibles de conversión en formato electrónico.","Las que contengan medios de pago a favor de los obligados, tales como cheques.","No se exceptúa ninguna notificación de los medios electrónicos.","Las respuestas a y b son correctas.","D"
"288","En los procedimientos iniciados de oficio, a los solos efectos de su iniciación, las Administraciones Públicas podrán recabar, mediante consulta a las bases de datos del Instituto Nacional de Estadística:","El número de teléfono o dirección electrónica recogidos en el Padrón Municipal.","El número de identificación del interesado recogido en el Padrón Municipal.","Los datos sobre el domicilio del interesado recogidos en el Padrón Municipal.","Todas las respuestas anteriores son correctas.","C"
"289","Según el artículo 41 de la Ley 39/2015, de 1 de octubre, del Procedimiento Administrativo Común de las Administraciones Públicas, la identificación adicional por parte de un interesado de un dispositivo electrónico y/o una dirección de correo electrónico servirá para:","Envió de notificaciones reguladas en el artículo 41 de la Ley 39/2015, de 1 de octubre, del Procedimiento Administrativo Común de las Administraciones Públicas.","Envío de avisos reguladas en el artículo 41 de la Ley 39/2015, de 1 de octubre, del Procedimiento Administrativo Común de las Administraciones Púbicas.","Envió de citaciones reguladas en el artículo 41 de la Ley 39/2015, de 1 de octubre, del Procedimiento Administrativo Común de las Administraciones Públicas.","Las respuestas a y c son correctas.","B"
"290","Cuando un interesado o su representante rechace la notificación de una actuación administrativa:","Se hará constar en el expediente, especificándose las circunstancias del intento de notificación y el medio.","Se dará por efectuado el trámite.","Se seguirá el procedimiento.","Todas las respuestas anteriores son correctas.","D"
"291","Las Administraciones podrán establecer la obligación de practicar electrónicamente las notificaciones para determinados procedimientos y para ciertos colectivos:","De personas físicas que por razón de su capacidad económica, técnica, dedicación profesional u otros motivos quede acreditado que tienen acceso y disponibilidad de los medios electrónicos necesarios.","De personas jurídicas que por razón de su capacidad económica, técnica, dedicación profesional u otros motivos quede acreditado que tienen acceso y disponibilidad de los medios electrónicos necesarios.","De personas físicas que por su especial relación profesional con la Administración sean más eficaces dichas notificaciones.","Las respuestas a y b son correctas.","A"
"292","En relación a las notificaciones, en los procedimientos iniciados a solicitud del interesado:","La notificación se realizará electrónicamente, a no ser que el interesado señale otro medio.","La notificación se practicará por el medio señalado por el interesado.","La notificación se practicará por el medio señalado por el Interesado. Está notificación será electrónica en los casos en los que exista obligación de relacionarse de esta forma con la Administración.","La notificación se realizará en papel, a no ser que el interesado señale otro medio.","C"
"293","Las Administraciones Públicas enviarán un aviso al dispositivo electrónico y/o dirección de correo electrónico del interesado que este haya comunicado, informándole de la puesta a disposición de una notificación en la sede electrónica de la Administración u Organismo correspondiente o en la dirección electrónica habilitada única. La falta de práctica de este aviso:","Impedirá que la notificación sea considerada plenamente valida.","No impedirá que la notificación sea considerada plenamente valida.","Depende del tipo de contenido de la notificación.","Depende del desarrollo reglamentario de cada Administración Pública.","B"
"294","A su juicio, ¿se puede realizar una notificación a través de SMS o dirección de correo electrónico?","Si, en virtud del artículo 41 de la vigente Ley de Procedimiento Administrativo Común.","Solo si la dirección de correo electrónico ha sido habilitada para notificaciones oficiales.","No, solo servirán para el envío de avisos electrónicos de notificación.","Solo si el interesado ha autorizado recibir avisos y notificaciones electrónicas.","C"
"295","En relación con la práctica de las notificaciones en papel, cuando el interesado accediera al contenido de la notificación en sede electrónica:","Se adoptará ya este sistema para sus notificaciones en el futuro.","Se le ofrecerá la posibilidad de que el resto de las notificaciones se puedan realizar a través de medios electrónicos.","No variara el sistema que tenga adjudicado de notificación.","Ninguna de las respuestas anteriores es correcta.","B"
"296","Cuando la notificación se practique en el domicilio del interesado, de no hallarse este presente, podrá hacerse cargo:","Cualquier persona que se encuentre en el domicilio y haga constar su Identidad.","Nadie, se anotará en el expediente el Intento de notificación junto con la hora y el día, y se repetirá por una sola vez para intentar notificar al interesado.","Cualquier persona que se encuentre en el domicilio.","Cualquier persona mayor de catorce años que se encuentre en el domicilio y haga constar su identidad.","D"
"297","En caso de que en el primer intento de notificación no haya sido posible entregar la misma, este se repetirá por una sola vez:","En una hora distinta dentro de los tres días siguientes.","No se repetirá de nuevo el intento de notificación, se anotará está circunstancia en el expediente del procedimiento correspondiente y se continuará con las actuaciones.","En una hora distinta dentro de los tres días siguientes, si el primer intento se ha realizado antes de las quince horas, deberá realizarse después de las quince horas y viceversa, dejando al menos un margen de diferencia de tres horas entre ambos intentos de notificación.","Mediante anuncio Publicado en el BOE.","C"
"298","Según el artículo 42 de la Ley 39/2015, de 1 de octubre, del Procedimiento Administrativo Común, todas las notificaciones que se practiquen en papel:","Deberán ser puestas a disposición del interesado en la sede electrónica de la Administración u Organismo actuante para que pueda acceder al contenido de las mismas de forma voluntaria.","Podrán ser puestas a disposición del interesado en la sede electrónica de la Administración u Organismo actuante para que pueda acceder al contenido de las mismas de forma voluntaria.","Deberán ser puestas a disposición del interesado en la sede electrónica de la Administración u Organismo actuante para que pueda acceder al contenido de las mismas de forma obligatoria.","Podrán ser puestas a disposición del interesado en la sede electrónica de la Administración u Organismo actuante para completar el contenido de las mismas.","A"
"299","A los efectos previstos en la práctica de las notificaciones a través de medios electrónicos, se entiende por comparecencia en la sede electrónica:","La identificación del interesado en la sede electrónica.","El acceso mediante certificado de seguridad a la sede electrónica.","El acceso por el interesado o su representante debidamente identificado al contenido de la notificación.","Ninguna de las respuestas anteriores es correcta.","C"
"300","Las notificaciones por medios electrónicos se entenderán practicadas en:","El momento en que se produzca el acceso a su contenido.","El momento que el interesado acceda a la sede electrónica.","Las respuestas a y b son correctas.","Las respuestas a y b son incorrectas.","A"
"301","Cuando la notificación por medios electrónicos sea de carácter obligatoria, o haya sido expresamente elegida por el interesado, se entenderá rechazada cuando haya transcurrido un plazo desde la puesta a disposición de la notificación sin que se acceda a su contenido. Este plazo es de:","30 días naturales.","20 días naturales.","15 días naturales.","10 días naturales.","D"
"302","Señale la respuesta más completa. Según el artículo 43 de la Ley 39/2015, de 1 de octubre, del Procedimiento Administrativo Común de las Administraciones Públicas, las notificaciones por medios electrónicos se practicarán:","A través de su comparecencia desde el Punto electrónico General de acceso de la Administración.","Mediante comparecencia en la sede electrónica de la Administración u organismo actuante, a través de la dirección electrónica habilitada única o mediante ambos sistemas.","Mediante comparecencia en la sede electrónica de la Administración u organismo actuante.","A través de la dirección electrónica habilitada única.","B"
"303","Indique cuál de las siguientes afirmaciones es correcta en relación a las direcciones electrónicas habilitadas:","Mediante la Dirección Electrónica Habilitada cualquier persona física o jurídica dispondrá de una dirección electrónica para la recepción de las notificaciones administrativas que por vía telemática pueda practicar las distintas Administraciones Públicas.","Como receptor de notificaciones, este servicio tiene carácter gratuito.","Asociado a la Dirección Electrónica Habilitada, su titular dispondrá de un buzón electrónico en el que recibirá las notificaciones electrónicas correspondientes a aquellos procedimientos a los que voluntariamente decida suscribirse.","Todas las respuestas anteriores son correctas.","D"
"304","La normativa donde está desarrollada la práctica de las notificaciones a través de medios electrónicos está contenida en el:","Real Decreto 1671/2016, de 6 de noviembre, por el que se desarrolla parcialmente la Ley 11/2007, de 22 de junio, de acceso electrónico de los ciudadanos a los servicios públicos.","Real Decreto 1671/2009, de 6 de noviembre, por el que se desarrolla parcialmente la Ley 11/2007, de 22 de junio, de acceso electrónico de los ciudadanos a los servicios públicos.","Real Decreto 1671/200g, de 6 de noviembre, por el que se desarrolla parcialmente la Ley 22/2007, de 11 de junio, de acceso electrónica de los ciudadanos a los servicias públicos.","Ninguna de las respuestas anteriores es correcta.","B"
